Review_ReviewID,ReviewTitle,ReviewContent
10113,"Star Trek: The Motion Picture ","A long time ago in a strange place called Hollywood, a theatrical cut of a movie was considered to be the director's cut. Now, with the advent of DVDs and the proliferation of special editions, numerous big-budget (and some not-so-big-budget) motion pictures are being given a second life in a format that is often quite different from the original version. For filmmakers who continuously like to tinker, this new philosophy is a godsend. They can release a truncated, studio-friendly version in theaters, then offer their ""true vision"" to DVD buyers.

This trend towards director's cuts/special editions was not started by George Lucas, but it was popularized by him. The financial windfall reaped when Lucas re-released the original three Star Wars films with new effects and footage awakened Hollywood executives to a previously-untapped resource. To be fair, most special editions exist primarily for creative reasons (although the studios backing them dream of $$$), and often result in a vastly improved product. James Cameron's The Abyss is a completely different movie - confusing and dissatisfying in the shortened theatrical version; sublime and brilliant in the director's cut. The hour added to Wolgang Petersen's Das Boot transforms it into a character-driven white-knuckler. Cameron Crowe's extended Almost Famous gives the story greater span and depth.

In 1979, the release of Star Trek - The Motion Picture represented the climax to every Star Trek fan's wet dream. The date, December 7, lived in infamy for the entire production crew. Paramount Pictures etched this date into their release calendar and informed everyone involved that the film would be ready on that day. Despite the Herculean effort by legendary director Robert Wise and his army of post-production assistants, the version of Star Trek - The Motion Picture that reached theaters was not complete. Effects scenes were unfinished, the sound mix was not perfected, and several important sequences were inexplicably left on the cutting room floor.

The movie that played in theaters during late 1979 and early 1980 received a mixed critical and popular reception. Star Trek fans were divided over the film. On one hand, it gave them the opportunity to spend time with characters who were as dear to them as old friends. On the other hand, it was largely a re-hash of previously-produced television episodes (in particular, ""The Changeling""). The general public, expecting a Star Wars clone and instead getting something more sedate and less action-oriented, was bored. Two unflattering nicknames were born: Star Trek - The Motionless Picture and Star Trek - The Motion Sickness. The movie was a financial success, grossing nearly $90 million domestically (against a $35 million budget), but a large portion of that was contributed by Trekkers who returned time and time again to theaters to re-watch the movie. It was not unusual to find die-hards who would proudly claim to have seen Star Trek - The Motion Picture 40, 50, or even 100 times. (This kind of repeat business, unheard of in the era of home video, did occasionally happen.)

The film opens with the destruction of three Klingon warships by a mysterious energy cloud that is on a direct heading for Earth. The newly redesigned U.S.S. Enterprise, the pride and joy of the United Federation of Planets, is the only ship available to intercept the cloud, and it hasn't undergone its shakedown cruise. Admiral James T. Kirk (William Shatner), restless after 2 1/2 years behind a desk, uses the crises to once again take command of the Enterprise, forcing the ship's expected captain, Will Decker (Stephen Collins), into the role of Executive Officer. Most of the crew is re-united, including the irascible Dr. McCoy (the late DeForest Kelley) and the half-Vulcan Mr. Spock (Leonard Nimoy). Spock senses a kinship with the vast consciousness that exists at the heart of the cloud. Also on board are Chief Engineer Scotty (James Doohan), Security Chief Chekov (Walter Koenig), Helmsman Sulu (George Takei), Communications Officer Uhura (Nichelle Nichols), and a newcomer, Navigator Ilia (Persis Khambatta).

After battling several systems failures, including a malfunctioning transporter that kills two crewman and a propulsion system that becomes unstable and creates a wormhole, the Enterprise makes contact with the entity within the cloud, called V'ger. The journey to the center of the alien ship is a strange and bizarre one. Ilia is killed when a probe invades the Enterprise bridge, and V'ger later sends a second probe to the ship in the form of a mechanism that mimics Ilia's body and features. Kirk learns that V'ger is a living machine traveling to Earth to make contact with its ""Creator"". If this contact is not made, V'ger intends to wipe out all of the human beings ""infesting"" the planet. It is up to the crew of the Enterprise to prevent that eventuality.

My recollections of seeing Star Trek - The Motion Picture during its initial release are of watching a lot of pretty images pass across the screen. The special effects sequences seemed to go on forever, with only an occasional glimpse of the actors reacting to what their characters were supposedly seeing. Subsequent viewings on videotape enabled me to more clearly pinpoint the film's flaws - poor pacing and a reliance upon special effects over character development. The sterile atmosphere of the new Starship Enterprise had seemingly seeped into the movie's tone, which was cool and unfriendly.

Now, more that 20 years later, Robert Wise has had the opportunity to return to the film and complete it in the manner he had originally envisioned. In addition to re-editing the movie, he was given the money to complete several effects sequences. The soundtrack was re-mixed and the picture was cleaned-up. The resultant product was released on DVD after consideration of a theatrical re-release was nixed. (A friend of mine who works for Paramount indicated that, had there been an actor's strike, Star Trek - The Motion Picture: Director's Edition would have been in multiplexes some time during 2002, but, since the strike didn't happen, tentative plans for a theatrical launch were scrapped.)

The film's total running length has hardly changed, expanding by four minutes from 2:12 to 2:16. However, alterations to the Director's Edition represent more than just adding a few scenes. Some material was either removed or replaced (all of the deleted scenes and trims are available as part of the DVD's supplementary material). In total, about 10% of the film is different from the theatrical cut, but the changes, while seemingly slight, result in a significantly improved motion picture. Star Trek - The Motion Picture: Director's Edition is no 2001 (its obvious inspiration - a fact that is more evident here than ever before), but it represents thought-provoking, well constructed science fiction.

So why is this version better than its theatrical sibling? The first, and most obvious, reason is that the pacing is better. Some of the new effects transform the V'ger trip into a more involving experience, and the inclusion of several character-based scenes that were previously edited out (Spock weeping for V'ger, Kirk ordering Scotty to prepare for a self-destruct) subtly shift the focus away from technical elements and back to the players. Wise's decisions about what to eliminate and what to add are inspired. The entire second act feels completely different. Secondly, the improved sound allows the audio to pack a punch that the original never did. And, finally, there's an intangible - because the movie explores ideas, it has aged better than many of its action-oriented contemporaries.

The ""idea"" aspect of Star Trek - The Motion Picture is enhanced in this version. The film spends more time exploring those unique qualities that make human beings special, and the importance of tempering logic and knowledge with emotion. Spock's breakthrough comes when he embraces his human half instead of rejecting it. For V'ger to grow, it must find a way to move beyond the cold machine logic of its programming. To do that, V'ger wants to ""join"" with its creator, and, in this, the film illuminates our need to strive for new goals and seek to attain the previously unattainable. And, while Star Trek - The Motion Picture doesn't answer the questions of ""Who am I? Why am I here?"", it isn't afraid to ask them.

It's interesting to note that the new special effects (produced by Foundation Imaging) - including an improved vision of Vulcan, a more impressive end to the wormhole sequence, our first view of the entire V'ger ship from the outside, and a change in the approach ""walkway"" to V'ger at the end - are done in such a manner that they blend seamlessly with the work done by Douglas Trumbell and John Dykstra 22 years ago. Nothing in Star Trek - The Motion Picture: Director's Edition seems out of place. A casual viewer who hasn't seen the film in more than two decades might assume that little or nothing had changed.

Jerry Goldsmith's score, which has since become a staple in the Star Trek musical lexicon, represents one of the film's strengths. It's the music, as much as the visuals, that makes the shuttle's initial approach to the Enterprise such a majestic moment. The sequence is overlong, but the thrill of hearing Goldsmith's score allows us to enjoy the moment rather than fall asleep. The ominous, ethereal strains of his V'ger themes enhance the sense that the Enterprise is penetrating ever deeper into a wondrous and dangerous realm as it moves deeper into the aliens' vessel.

When it comes to a Star Trek movie, the quality of acting is largely irrelevant. The familiar faces are all there doing pretty much what we expect them to do. William Shatner, ever the ham, applies his unique brand of overacting to Kirk, and we welcome it. (To be fair, Shatner is capable of giving a good performance as Kirk - something he does in Star Treks II, III, and VI.) Leonard Nimoy imbues Spock with a quiet dignity and DeForest Kelley slides easily into the part of the anti-technology old country doctor. The camaraderie between Kirk, Spock, and McCoy, one of the strengths of the TV series, is in evidence here, although not to the extent that it could have been. As far as the newcomers are concerned, Stephen Collins is solid as Decker. However, while Persis Khambatta is striking to look at as the svelte, bald Ilia, this is not a memorable example of acting.

Re-visiting Star Trek - The Motion Picture via this director's cut is like seeing a familiar story unfold in a new way. Wise's picture was an ambitious effort from the beginning, striving for a greatness that it never attained. In this new version, it still falls short, but not by as much. It has taken more than 20 years for Robert Wise to return to his chapter of the Star Trek saga and fulfill his vision. With no hesitation, I can say that it has been worth the wait. Star Trek - The Motion Picture: Director's Edition vaults this movie from a position as one of the weakest entries in the long-running film series to a perch as one of the strongest."
10114,"THE GODFATHER, PART III","""The Godfather, Part III"" continues the Corleone family history in 1979, as the sins of the parents are visited upon the children. Despite every attempt to go legit, to become respectable, the past cannot be silenced. The family has amassed unimaginable wealth, and as the film opens Michael Corleone (Al Pacino) is being invested with a great honor by the church. Later that day, at a reception, his daughter announces a Corleone family gift to the church and the charities of Sicily, ""a check in the amount of $100 million."" But the Corleones are about to find, as others have throughout history, that you cannot buy forgiveness. Sure, you can do business with evil men inside the church, for all men are fallible and capable of sin. But God does not take payoffs.
Michael is older now and walks with a stoop. He has a diabetic condition. He has spent the years since ""The Godfather, Part II"" trying to move the family out of crime and into legitimate businesses. He has turned over a lot of the old family rackets to a new generation, to people like Joey Zasa (Joe Mantegna), who is not scrupulous about dealing dope, who is capable of making deals that would offend the fastidious Michael. It is Michael's dream, now that he senses his life is coming to a close, that he can move his family into the light.
But the past is seductive. Because Michael knows how to run a Mafia family, there is great pressure on him to do so. And throughout ""Godfather III"" we are aware of the essential tragedy of this man, the fact that the sins that stain his soul will not wash off - especially the sin of having ordered the death of his brother Fredo.
Michael is positioned in the story between two characters who could come from ""King Lear"" - his daughter, Mary (Sofia Coppola), whom he loves and wants to give his kingdom to, and Sonny's son, Vincent (Andy Garcia), who sees the death of his enemies as the answer to every question. Michael is torn between the futures represented by the two characters, between Mary, quiet and naive, and the hot-blooded Vincent. And when Vincent seduces Mary and makes her his own, Michael's plans begin to go wrong.
There is also Kay Corleone (Diane Keaton), of course, still the woman Michael loves, and the mother of his children. He wants their son, Anthony, to join the family business. She defends his ambition to be an opera singer. They face each other like skilled opponents.
Perhaps she even still loves him, too, or would if she did not know him so well. She is the only person who can tell Michael what she really thinks, and in one of those dark, gloomy rooms, she lets him know that it doesn't matter what grand order he is invested in by the church, he is at heart still a gangster. The best scenes in ""Godfather III"" are between these two, Michael and Kay, Pacino and Keaton, fiercely locked in a battle that began too many years ago, at that wedding feast where Michael told Kay he was not part of his family business.
The plot of the movie, concocted by Coppola and Mario Puzo in a screenplay inspired by headlines, brings the Corleone family into the inner circles of corruption in the Vatican. Actual events - the untimely suddenness of John Paul I's death, the scandals at the Vatican Bank, the body of a Vatican banker found hanging from a London bridge - are cheerfully intertwined with the Corleone's fictional story, and it is suggested that the Vatican lost hundreds of millions in a fraud. We eavesdrop on corrupt Vatican officials, venal cardinals scheming in the vast Renaissance palaces that dwarf them, and we travel to Sicily so that Michael Corleone can consult with Don Tommasino, his trusted old friend, to discover who is plotting against him within the Mafia council.
They are so seductive, these byzantine intrigues. Alliances are forged with a pragmatic decision, betrayed with sudden violence.
Always there is someone in a corner, whispering even more devious advice. This trait of operatic plotting and betrayal is practiced beautifully by Connie Corleone (Talia Shire), Michael's sister, who has turned in middle age into a fierce, thin-faced woman in black, who stands in the deepest shadows, who schemes and lobbies for her favorites - especially for Vincent, whom she wants Michael to accept and embrace.
In the ""Godfather"" movies Coppola has made a world. Because we know it so intimately, because its rhythms and values are instantly recognizable to us, a film like ""The Godfather Part III"" probably works better than it should. If you stand back and look at it rationally, this is a confusing and disjointed film. It is said that Coppola was rewriting it as he went along, and indeed it lacks the confident forward sweep of a film that knows where it's going.
Some of the dialogue scenes, especially in the beginning, sound vaguely awkward; the answers do not fit the questions, and conversations seem to have been rewritten in the editing room. Other shots - long shots, into the light, so we cannot see the characters' lips -- look suspiciously like scenes that were filmed first and dubbed later. The whole ambitious final movement of the film - in which two separate intrigues are intercut with the progress of an opera being sung by Anthony -- is intended to be suspenseful but is so confusing, we are not even sure which place (Sicily, Rome, London?) one of the intrigues is occurring. The final scene of the movie, which is intended to echo Marlon Brando's famous death scene, is perfunctory and awkward.
And yet it's strange how the earlier movies fill in the gaps left by this one, and answer the questions. It is, I suspect, not even possible to understand this film without knowing the first two, and yet, knowing them, ""Part III"" works better than it should, evokes the same sense of wasted greatness, of misdirected genius. Both Don Vito Corleone and Don Michael Corleone could have been great men. But they lacked that final shred of character that would have allowed them to break free from their own pasts. Or perhaps their tragedies were dictated by circumstances. Perhaps they were simply born into the wrong family.
And so here we are back again, in the rich, deep brown rooms inhabited by the Corleone family, the rooms filled with shadows and memories, and regretful decisions that people may have to die. We have been taught this world so well by Francis Ford Coppola that we enter it effortlessly has there ever before been a film saga so seductive and compelling, so familiar to us that even after years we remember all of the names of the players? Here, for example, is a new character, introduced as ""Sonny's illegitimate son,"" and, yes, we nod like cousins at a family reunion, yes, he does seem a lot like Sonny.
He's the same kind of hotheaded, trigger-happy lunatic."
10115,"INDIANA JONES AND THE LAST CRUSADE","There is a certain style of illustration that appeared in the boys' adventure magazines of the 1940s - in those innocent publications that have been replaced by magazines on punk lifestyles and movie monsters. The illustrations were always about the same. They showed a small group of swarthy men hovering over a treasure trove with greedy grins on their bearded faces, while in the foreground, two teenage boys peered out from behind a rock in wonder and astonishment. The point of view was always over the boys' shoulders; the reader was invited to share this forbidden glimpse of the secret world of men.
“Indiana Jones and the Last Crusade” begins with just such a scene; director Steven Spielberg must have been paging through his old issues of Boys' Life and Thrilling Wonder Tales, down in the basement.
As I watched it, I felt a real delight, because recent Hollywood escapist movies have become too jaded and cynical, and they have lost the feeling that you can stumble over astounding adventures just by going on a hike with your Scout troop.
Spielberg lights the scene in the strong, basic colors of old pulp magazines. When the swarthy men bend over their discovery, it seems to glow with a light of its own, which bathes their faces in a golden glow. This is the kind of moment that can actually justify a line like It's mine! All mine! - although Spielberg does not go so far.
One of the two kids behind the boulder is, of course, the young Indiana Jones. But he is discovered by explorers plundering an ancient treasure, and escapes just in the nick of time. The sequence ends as an adult claps a battered fedora down on Indiana's head, and then we flash forward to the era of World War II.
The opening sequence of this third Indiana Jones movie is the only one that seems truly original - or perhaps I should say, it recycles images from 1940s pulps and serials that Spielberg has not borrowed before. The rest of the movie will not come as a surprise to students of Indiana Jones, but then how could it? The Jones movies by now have defined a familiar world of death-defying stunts, virtuoso chases, dry humor and the quest for impossible goals in unthinkable places.
When “Raiders of the Lost Ark” appeared, it defined a new energy level for adventure movies; it was a delirious breakthrough. But there was no way for Spielberg to top himself, and perhaps it is just as well that “Last Crusade” will indeed be Indy's last film. It would be too sad to see the series grow old and thin, like the James Bond movies.
Even in this third adventure, some of the key elements are recycled from “Raiders.” This time, Indy's quest is to find the Holy Grail, the cup Jesus Christ is said to have used at the Last Supper.
(To drink from the cup is to have eternal youth.) The Holy Grail reminds us of the Ark of the Covenant in the first film, and in both cases the chase is joined by Nazi villains.
The new element this time is how Spielberg fills in some of the past of the Jones character. We learn his real name (which I would not dream of revealing here), and we meet his father, Professor Henry Jones, who is played by Sean Connery on exactly the right note.
Like the fathers of classic boys' stories, Dr. Jones is not a parent so much as a grown-up ally, an older pal who lacks three dimensions because children are unable to see their parents in that complexity. I kept being reminded of the father in the Hardy Boys books, who shook his head and smiled at the exploits of his lovable lads and only rarely “expressed concern” or “cautioned them sternly.” Since the Hardy Boys were constantly involved, at a tender age, with an endless series of counterfeiters, car thieves, kidnap rings, Nazi spies and jewel thieves, their father's detachment seemed either saintly or mad - and Connery has fun with some of the same elements.
Harrison Ford is Indiana Jones again this time, and what he does seems so easy, so deadpan, that few other actors could maintain such a straight and credible presence in the midst of such chaos. After young Indy discovers his life's mission in the early scenes, the central story takes place years later, when Dr. Jones (the world's leading expert on the Holy Grail) is kidnapped by desperados who are convinced he knows the secret of where it is now hidden.
He does. And Indy, working from his father's notebook, follows a trail from America to the watery catacombs beneath Venice, and then to the deserts of the Holy Land, where there is a sensational chase scene involving a gigantic Nazi armored tank.
He is accompanied on his mission by Dr. Elsa Schneider (Alison Doody), an art historian he meets in Venice. But the character is a disappointment after the fire of Karen Allen in the first movie, and even the sultriness of Kate Capshaw in the second.
Spielberg devises several elaborate set-pieces, of which I especially liked the rat-infested catacombs and sewers beneath Venice.
(I tried not to remember that Venice, by definition, has no catacombs.) The art direction looks great in a scene involving a zeppelin, and an escape from the airship by airplane. And the great tank in the desert is fearsome and convincing.
If there is just a shade of disappointment after seeing this movie, it has to be because we will never again have the shock of this material seeming new. “Raiders of the Lost Ark,” now more than ever, seems a turning point in the cinema of escapist entertainment, and there was really no way Spielberg could make it new all over again.
What he has done is to take many of the same elements, and apply all of his craft and sense of fun to make them work yet once again. And they do."
