Review_ReviewID,ReviewTitle,ReviewContent
10127,"LORD OF THE RINGS: THE FELLOWSHIP OF THE RING","We invest Hobbits with qualities that cannot be visualized. In my mind, they are good-hearted, bustling, chatty little creatures who live in twee houses or burrows, and dress like the merry men of Robin Hood--in smaller sizes, of course. They eat seven or eight times a day, like to take naps, have never been far from home and have eyes that grow wide at the sounds of the night. They are like children grown up or grown old, and when they rise to an occasion, it takes true heroism, for they are timid by nature and would rather avoid a fight.
Such notions about Hobbits can be found in ""Lord of the Rings: The Fellowship of the Ring,"" but the Hobbits themselves have been pushed off center stage. If the books are about brave little creatures who enlist powerful men and wizards to help them in a dangerous crusade, the movie is about powerful men and wizards who embark on a dangerous crusade, and take along the Hobbits. That is not true of every scene or episode, but by the end ""Fellowship"" adds up to more of a sword and sorcery epic than a realization of the more naive and guileless vision of J. R. R. Tolkien.
The Ring Trilogy embodies the kind of innocence that belongs to an earlier, gentler time. The Hollywood that made ""The Wizard of Oz"" might have been equal to it. But ""Fellowship"" is a film that comes after ""Gladiator"" and ""Matrix,"" and it instinctively ramps up to the genre of the overwrought special-effects action picture. That it transcends this genre--that it is a well-crafted and sometimes stirring adventure--is to its credit. But a true visualization of Tolkien's Middle-earth it is not.
Wondering if the trilogy could possibly be as action-packed as this film, I searched my memory for sustained action scenes and finally turned to the books themselves, which I had not read since the 1970s. The chapter ""The Bridge of Khazad-Dum"" provides the basis for perhaps the most sensational action scene in the film, in which Gandalf the wizard stands on an unstable rock bridge over a chasm, and must engage in a deadly swordfight with the monstrous Balrog. This is an exciting scene, done with state-of-the-art special effects and sound that shakes the theater. In the book, I was not surprised to discover, the entire scene requires less than 500 words.
Settling down with my book, the one-volume, 1969 India paper edition, I read or skimmed for an hour or so. It was as I remembered it. The trilogy is mostly about leaving places, going places, being places, and going on to other places, all amid fearful portents and speculations. There are a great many mountains, valleys, streams, villages, caves, residences, grottos, bowers, fields, high roads, low roads, and along them the Hobbits and their larger companions travel while paying great attention to mealtimes. Landscapes are described with the faithful detail of a Victorian travel writer. The travelers meet strange and fascinating characters along the way, some of them friendly, some of them not, some of them of an order far above Hobbits or even men. Sometimes they must fight to defend themselves or to keep possession of the ring, but mostly the trilogy is an unfolding, a quest, a journey, told in an elevated, archaic, romantic prose style that tests our capacity for the declarative voice.
Reading it, I remembered why I liked it in the first place. It was reassuring. You could tell by holding the book in your hands that there were many pages to go, many sights to see, many adventures to share. I cherished the way it paused for songs and poems, which the movie has no time for. Like The Tale of Genji, which some say is the first novel, ""The Lord of the Rings"" is not about a narrative arc or the growth of the characters, but about a long series of episodes in which the essential nature of the characters is demonstrated again and again (and again). The ring, which provides the purpose for the journey, serves Tolkien as the ideal MacGuffin, motivating an epic quest while mostly staying right there on a chain around Frodo Baggins' neck.
Peter Jackson, the New Zealand director who masterminded this film (and two more to follow, in a $300 million undertaking), has made a work for, and of, our times. It will be embraced, I suspect, by many Tolkien fans and take on aspects of a cult. It is a candidate for many Oscars. It is an awesome production in its daring and breadth, and there are small touches that are just right; the Hobbits may not look like my idea of Hobbits (may, indeed, look like full-sized humans made to seem smaller through visual trickery), but they have the right combination of twinkle and pluck in their gaze--especially Elijah Wood as Frodo and Ian Holm as the worried Bilbo.
Yet the taller characters seem to stand astride the little Hobbit world and steal the story away. Gandalf the good wizard (Ian McKellen) and Saruman the treacherous wizard (Christopher Lee) and Aragorn (Viggo Mortensen), who is the warrior known as Strider, are so well-seen and acted, so fearsome in battle, that we can't imagine the Hobbits getting anywhere without them. The elf Arwen (Liv Tyler), the Elf Queen Galadriel (Cate Blanchett) and Arwen's father, Elrond (Hugo Weaving), are not small like literary elves (""very tall they were,"" the book tells us), and here they tower like Norse gods and goddesses, accompanied by so much dramatic sound and lighting that it's a wonder they can think to speak, with all the distractions.
Jackson has used modern special effects to great purpose in several shots, especially one where a massive wall of water forms and reforms into the wraiths of charging stallions. I like the way he handles crowds of Orcs in the big battle scenes, wisely knowing that in a film of this kind, realism has to be tempered with a certain fanciful fudging. The film is remarkably well made. But it does go on, and on, and on--more vistas, more forests, more sounds in the night, more fearsome creatures, more prophecies, more visions, more dire warnings, more close calls, until we realize this sort of thing can continue indefinitely. ""This tale grew in the telling,"" Tolkien tells us in the famous first words of his foreword; it's as if Tolkien, and now Jackson, grew so fond of the journey, they dreaded the destination.
That ""Fellowship of the Ring"" doesn't match my imaginary vision of Middle-earth is my problem, not yours. Perhaps it will look exactly as you think it should. But some may regret that the Hobbits have been pushed out of the foreground and reduced to supporting characters. And the movie depends on action scenes much more than Tolkien did. In a statement last week, Tolkien's son Christopher, who is the ""literary protector"" of his father's works, said, ""My own position is that 'The Lord of the Rings' is peculiarly unsuitable to transformation into visual dramatic form."" That is probably true, and Jackson, instead of transforming it, has transmuted it, into a sword-and-sorcery epic in the modern style, containing many of the same characters and incidents."
10128,"Terminator, The","The Terminator, the film that catapulted Arnold Schwarzengger into Hollywood's stratosphere, was never designed for more than a niche audience. Indeed, while the film made a nice profit for Orion Pictures (returning grosses about six times its cost), it did not make the kind of money that would cause it to be labeled a ""blockbuster"" or that would justify a sequel. But The Terminator arrived at a time when America's appetite for science fiction was escalating and when the home video revolution was taking off. Although only a minor success in theaters, The Terminator was a gargantuan hit on home video. And, when James Cameron solidified his reputation by directing Aliens, it became unthinkable that there would not be a sequel to The Terminator.

The movie's strength is that, like The Matrix, it combines action with ideas. This isn't a run-of-the-mill turn-off-the-brain collection of chases and fight scenes. The plot, which involves time travel and the paradoxes inherent therein, requires viewers to pay attention or risk having no idea what's happening. I remember leaving the theater 25 years ago and hearing a girl remark: ""I liked it but I didn't understand what was going on. Was that guy from the future Arnold's father?"" Cameron, as it turns out, took a little too much license in claiming full credit for the story. Noted science fiction author Harlan Ellison sued, arguing that The Terminator bore more than a passing resemblance to two of his Outer Limits teleplays, ""Soldier"" (about two time-traveling soldiers who end up in 1964, where they fight to the death) and ""Demon with a Glass Hand"" (about a time-traveling robot that looks like a man). The settlement resulted in Ellison gaining an on-tape credit as well as an undisclosed amount of money.

It is 1984. The stillness of the night is interrupted as a portal in time opens. Through that portal arrives The Terminator (Arnold Schwarzenegger), a ruthless killer from the year 2029. Future Earth is at war: man against machines. The Terminator's mission is to eliminate the leader of the humans before his birth. Sarah Connor (Linda Hamilton), the eventual mother of John Connor, has been targeted for termination. But The Terminator is not the only one to make use of a time portal. Also sent through is Kyle Reese (Michael Biehn), John Connor's right-hand-man. His goal: protect Sarah.

The Terminator is structured as one long chase, with the vulnerable Sarah and Reese fleeing from the relentless Terminator. At first, Sarah distrusts Reese, believing him to be demented. But, once The Terminator has destroyed a police station and killed most of the cops within, she has no choice but to trust Reese. That bond develops into a romance, but The Terminator's pursuit allows little opportunity for down time or sweet nothings. Nevertheless, Cameron has a knack for getting us to care about the characters and their relationship even though not a lot of time is spent getting to know them. (There are actually more ""character building"" sequences in the more heavily action-oriented Terminator 2.)

Key special effects, which were cutting edge in 1984, appear dated by today's standards. Stan Winston's stop-animation Terminator, which takes over for Schwarzenegger at the end, looks like what it is: the product of a special effects lab. It's not credible, but the story is strong enough to overcome such shortcomings. In fact, some of the other visual chicanery - time travel effects, Schwarzenegger's makeup, and flash-forward scenes set in a post-apocalyptic 2029 - are effective. By the time Terminator 2 arrived, Cameron had both the budget and the ability to better integrate the robot Terminator into its surroundings. The herky-jerky awkwardness that marks the climax of the first movie is not evident during the sequels.

Paradoxes inevitably form the entertainment core for any time travel story, and The Terminator is no exception. (SPOILER AHEAD!) In this case, the supposition is that a person can die before he is born as long as his personal time line is unbroken. Thus, Reese comes into the world at a time after the events chronicled in The Terminator, then travels back to a date before his birth, fathers the son who will send him back, and is ""terminated"" before he is born. This is not a complex time travel concept (requiring only an understanding of time as fluid), and it's more straightforward than the one addressed in Terminator 2.

In the casting department, few character/actor pairings have been better fits than Arnold Schwarzenegger as The Terminator. In 1984, the former Mr. Olympia boasted limited feature acting experience (primarily from two Conan movies) but provided what Cameron wanted from The Terminator: an imposing physique and an implacable countenance. Schwarzenegger had both, and his Achilles heel - the occasional inability to deliver dialogue convincingly - was not an impediment. The role demanded only the occasional one-liner (one of which, ""I'll be back,"" became the actor's trademark). Cameron transformed every one of Schwarzenegger's perceived negatives into strengths and, in the process, re-defined him in Hollywood's eyes. In the wake of The Terminator, Schwarzenegger was in demand.

The film's other two leads, Michael Biehn and Linda Hamilton, share some acting characteristics - neither has tremendous range but both are charismatic, physically adept, and provide the requisite intensity. Biehn was a Cameron ""regular"" early in his career, then moved fully into B movies, an arena where he continues to thrive. Genre fans remember him best as Hicks, Sigourney Weaver's semi-love interest from Aliens. Linda Hamilton was virtually unknown at the time of her casting. In years to come, she would reprise this role (in a considerably buffed up form), marry and divorce James Cameron (she was his fourth wife), and become a beloved cult figure for her part in the TV series Beauty and the Beast.

The potential evidenced by Cameron in The Terminator - the ability to sustain suspense, meld action with story, and provide compelling characters despite the limitations of the actors portraying them - would be fully realized in two future features, Aliens and Terminator 2. This movie, however, is in some ways more impressive than either of those because of what the filmmaker was capable of achieving with a limited budget and without significant studio backing. The themes and ideas presented in The Terminator hold up well today, even though we have moved into the post-Cold War era and only the most nihilistic individuals could see 2029 in such bleak terms. It's a rousing science fiction story that proves an on-screen adrenaline rush need not short-circuit the brain."
10129,"Spirited Away","To animators across the world, Hayao Miyazaki is a god. Within the animation community, his work is revered, and fans of “anime” (Japanese animation) await each new Miyazaki film with the same degree of ill-concealed impatience as displayed by 11-year olds hungering for the next book in the “Harry Potter” series. In mainstream United States movie-going circles, Miyazaki is not a well-known name, which is one reason why, several years ago, Walt Disney Pictures purchased the North American rights to Miyazaki’s catalog. While there were some gripes about the manner in which the dubbing and distribution of Miyazaki’s previous feature, Princess Mononoke, were handled here, more care has been taken for Spirited Away. Two American animation luminaries – Pixar’s John Lasseter and Disney’s Kirk Wise (the director of several animated features, including Beauty and the Beast) – were recruited to convert the Japanese version of the movie into one for English-speaking audiences.

Let me state up front that I am neither a fan of, nor an expert on, anime. In fact, I’m not a lover of animation in general. But I know when I’m in the presence of good storytelling, and Spirited Away represents that. Watching this movie, you immediately become aware of two things – the animation is excellent (something that will come as no surprise to anyone who has seen one of Miyazaki’s previous outings) and the story turns in unusual, often unexpected directions. One of the biggest problems I have with many animated films (even the best ones) is plot predictability. That’s not the case here.

Spirited Away takes influences from “Alice in Wonderland” and “The Wizard of Oz” and uses them to fashion a highly original story about a 10 year-old girl, Chihiro (voiced by Daveigh Chase), who, along with her parents, ventures through a tunnel that leads to the world of spirits. After a witch, Yubaba (Suzanne Pleshette), turns Mom and Dad into pigs, Chihiro must find a niche in the spirit world, where humans are not well thought-of, and figure out a way to convince Yubaba to change her parents back into humans and send them all home. With help from Haku (Jason Marsden), Yubaba’s boy apprentice, and Lin (Susan Egan), a “big sister” type, Chihiro gets a job at Yubaba’s bathhouse for sprits, and there her quest to aid her family begins. But, as complications arise, she finds additional tasks to perform and other allies willing to help her.

The nature of the story is tailor-made for animation. Many of the characters engage in shape-shifting (boys become dragons, adults become pigs, a giant baby becomes a bloated mouse) and the bathhouse is frequented by a variety of strange and unusual creatures. While a few of the inhabitants of the sprit world look human, most appear to be anything but that. Take the boiler operator Kamaji (David Ogden Stiers), for example. At first glance, he’s just a cranky old man with a frizzy beard. Then we notice that he has eight legs and walks like a spider. We also find out that he’s not as intimidating as he looks. His initially surly disposition melts away and he becomes of one Chihiro’s numerous friends.

Miyazaki is an environmentalist, and his films often contain strong pro-environment messages. (This was a cornerstone to Princess Mononoke.) In Spirited Away, one of the visitors to the bathhouse is a river spirit who has been so badly polluted by sludge and other waste materials that his stench drives people away and he is in need of a powerful cleansing to sluice away the filth. It takes an effort, but he is eventually restored to his former glory.

The film’s animation is stunning, with richly-detailed backgrounds and flawless foregrounds. Unlike many animators, Miyazaki still relies almost exclusively upon hand-drawn artwork (although he employs some computer technology to touch up and enhance the final product), and his meticulous care shows. The colors are bright and vivid, and some of the scenes (especially those taking place during a rainstorm) are peerless in the world of motion picture animation. Also, with a running length that exceeds two hours (124 minutes), Spirited Away requires approximately 40% more cells than what is needed for the average Disney release.

Miyazaki does not dumb down Spirited Away, even though his stated target audience is children. This is a true family film, in that adults will be as enchanted by the characters and situations as children will. The pace is a little slower than the average animated film – there is not as much frantic action – but not so languid that younger viewers will become restless. The dubbing into English is very good (as is voice selection), so there is no subtitle barrier. Overall, while Spirited Away may not be as complex and imaginative as Princess Mononoke in some areas, it is as beautifully rendered and no less sophisticated in its outlook. Miyazaki has provided another triumph, and, in the midst of the quality fall-off of Disney’s in-house animated projects, a reason for animation-lovers to rejoice."
10130,"Review: ‘The Godfather Part III’","The Godfather Part III matches its predecessors in narrative intensity, epic scope, socio-political analysis, physical beauty and deep feeling for its characters and milieu. In addition, the $55 million-plus production is the most personal of the three for the director.

Variety Staff
The Godfather Part III matches its predecessors in narrative intensity, epic scope, socio-political analysis, physical beauty and deep feeling for its characters and milieu. In addition, the $55 million-plus production is the most personal of the three for the director.

Like the original, Part III opens with a lengthy festival celebration punctuated by backroom dealings. It is 1979, and Michael Corleone, having divested himself of his illegal operations, is being honored by the Catholic Church for his abundant charitable activities.

Hopeful of bringing his family closer together, Michael dotes on his daughter Mary (Sofia Coppola), and understandably becomes perturbed by her affair with cousin Vincent (Andy Garcia), hot-headed, violence-prone illegitimate son of Michael’s late brother Sonny. Vincent has been unhappily working for slumlord and old-style thug Joey Zasa (Joe Mantegna), who has taken on Michael’s less savory holdings.

Bad blood between the ruthless Zasa and the Corleone family mounts just as Michael tries, with $600 million, to buy a controlling interest in the European conglomerate Immobiliare, a move that would cement his business legitimacy and financial future.

After 80 minutes, the action switches to Italy, where it remains for the duration. Pacino and Eli Wallach’s old dons can’t help begin scheming against one another. In one of the most masterful examples of sustained intercutting in cinema, the performance on opening night of Pacino’s son in Cavalleria Rusticana serves as the backdrop for several murderous missions.

For the third time out in his career role, Pacino is magnificent. Garcia brings much-needed youth and juice to the ballsy Vincent, heir apparent to the Corleone tradition, much as James Caan sparked the first film and Robert De Niro invigorated the second.

Diane Keaton proves a welcome, if brief, presence in warming the film, and Talia Shire seems pleased with the opportunity to do some dirty work at long last.

Film’s main flaw, unavoidably, is Sofia Coppola in the important, but not critical, role of Michael’s daughter. Unfortunate casting decision was made after original actress Winona Ryder had to bow out at the start of production."
