Review_ReviewID,ReviewTitle,ReviewContent
10120,"SPIRITED AWAY","""Miyazaki's Spirited Away"" has been compared to ""Alice in Wonderland,"" and indeed it tells of a 10-year-old girl who wanders into a world of strange creatures and illogical rules. But it's enchanting and delightful in its own way, and has a good heart. It is the best animated film of recent years, the latest work by Hayao Miyazaki, the Japanese master who is a god to the Disney animators.
Because many adults have an irrational reluctance to see an animated film from Japan (or anywhere else), I begin with reassurances: It has been flawlessly dubbed into English by John Lasseter (""Toy Story""), it was co-winner of this year's Berlin Film Festival against ""regular"" movies, it passed ""Titanic"" to become the top-grossing film in Japanese history, and it is the first film ever to make more than $200 million before opening in America.
I feel like I'm giving a pitch on an infomercial, but I make these points because I come bearing news: This is a wonderful film. Don't avoid it because of what you think you know about animation from Japan. And if you only go to Disney animation--well, this is being released by Disney.
Miyazaki's works (""My Neighbor Totoro,"" ""Kiki's Delivery Service,"" ""Princess Mononoke"") have a depth and complexity often missing in American animation. Not fond of computers, he draws thousand of frames himself, and there is a painterly richness in his work. He's famous for throwaway details at the edges of the screen (animation is so painstaking that few animators draw more than is necessary). And he permits himself silences and contemplation, providing punctuation for the exuberant action and the lovable or sometimes grotesque characters.
""Spirited Away"" is told through the eyes of Chihiro (voice by Daveigh Chase), a 10-year-old girl, and is more personal, less epic, than ""Princess Mononoke."" As the story opens, she's on a trip with her parents, and her father unwisely takes the family to explore a mysterious tunnel in the woods. On the other side is what he speculates is an old theme park; but the food stalls still seem to be functioning, and as Chihiro's parents settle down for a free meal, she wanders away and comes upon the film's version of wonderland, which is a towering bathhouse.
A boy named Haku appears as her guide, and warns her that the sorceress who runs the bathhouse, named Yubaba, will try to steal her name and thus her identity. Yubaba (Suzanne Pleshette) is an old crone with a huge face; she looks a little like a Toby mug, and dotes on a grotesquely huge baby named Boh. Ominously, she renames Chihiro, who wanders through the structure, which is populated, like ""Totoro,"" with little balls of dust that scurry and scamper underfoot.
In the innards of the structure, Chihiro comes upon the boiler room, operated by a man named Kamaji (David Ogden Stiers), who is dressed in a formal coat and has eight limbs, which he employs in a bewildering variety of ways. At first he seems as fearsome as the world he occupies, but he has a good side, is no friend of Yubaba, and perceives Chihiro's goodness.
If Yubaba is the scariest of the characters and Kamaji the most intriguing, Okutaresama is the one with the most urgent message. He is the spirit of the river, and his body has absorbed the junk, waste and sludge that has been thrown into it over the years. At one point, he actually yields up a discarded bicycle. I was reminded of a throwaway detail in ""My Neighbor Totoro,"" where a child looks into a bubbling brook, and there is a discarded bottle at the bottom. No point is made; none needs to be made.
Japanese myths often use shape-shifting, in which bodies reveal themselves as facades concealing a deeper reality. It's as if animation was invented for shape-shifting, and Miyazaki does wondrous things with the characters here. Most alarming for Chihiro, she finds that her parents have turned into pigs after gobbling up the free lunch. Okutaresama reveals its true nature after being freed of decades of sludge and discarded household items. Haku is much more than he seems. Indeed the entire bathhouse seems to be under spells affected the appearance and nature of its inhabitants.
Miyazaki's drawing style, which descends from the classical Japanese graphic artists, is a pleasure to regard, with its subtle use of colors, clear lines, rich detail and its realistic depiction of fantastical elements. He suggests not just the appearances of his characters, but their natures. Apart from the stories and dialogue, ""Spirited Away"" is a pleasure to regard just for itself. This is one of the year's best films.
"
10121,"LORD OF THE RINGS: THE TWO TOWERS","With ""Lord of the Rings: The Two Towers,"" it's clear that director Peter Jackson has tilted the balance decisively against the hobbits and in favor of the traditional action heroes of the Tolkien trilogy. The star is now clearly Aragorn (Viggo Mortensen), and the hobbits spend much of the movie away from the action. The last third of the movie is dominated by an epic battle scene that would no doubt startle the gentle medievalist J.R.R. Tolkien.
The task of the critic is to decide whether this shift damages the movie. It does not. ""The Two Towers"" is one of the most spectacular swashbucklers ever made, and, given current audience tastes in violence, may well be more popular than the first installment, ""The Fellowship of the Ring."" It is not faithful to the spirit of Tolkien and misplaces much of the charm and whimsy of the books, but it stands on its own as a visionary thriller. I complained in my review of the first film that the hobbits had been short-changed, but with this second film I must accept that as a given, and go on from there.
""The Two Towers"" is a rousing adventure, a skillful marriage of special effects and computer animation, and it contains sequences of breathtaking beauty. It also gives us, in a character named the Gollum, one of the most engaging and convincing CGI creatures I've seen. The Gollum was long in possession of the Ring, now entrusted to Frodo, and misses it (""my precious"") most painfully; but he has a split personality and (in between spells when his dark side takes over) serves as a guide and companion for Frodo (Elijah Wood) and Sam (Sean Astin). His body language is a choreography of ingratiation and distortion.
The film introduces another computer-generated character, Treebeard, a member of the most ancient race in Middle-Earth, a tree that walks and talks and takes a very long time to make up its mind, explaining to Merry and Pippin that slowness is a virtue. I would have guessed that a walking, talking tree would look silly and break the spell of the movie, but no, there is a certain majesty in this mossy old creature.
The film opens with a brief reprise of the great battle between Gandalf (Ian McKellen) and Balrog, the monster made of fire and smoke, and is faithful to the ancient tradition of movie serials by showing us that victory is snatched from certain death, as Gandalf extinguishes the creature and becomes in the process Gandalf the White.
To compress the labyrinthine story into a sentence or two, the enemy is Saruman (Christopher Lee), who commands a vast army of Uruk-Hai warriors against the fortress of Theoden (Bernard Hill). Aragorn joins bravely in the fray, but the real heroes are the computer effects, which create the castle, landscape, armies and most of the action.
There are long stretches of ""The Two Towers"" in which we are looking at mostly animation on the screen. When Aragorn and his comrades launch an attack down a narrow fortress bridge, we know that the figures toppling to their doom are computer-generated, along with everything else on the screen, and yet the impact of the action is undeniable. Peter Jackson, like some of the great silent directors, is unafraid to use his entire screen, to present images of wide scope and great complexity. He paints in the corners.
What one misses in the thrills of these epic splendors is much depth in the characters. All of the major figures are sketched with an attribute or two, and then defined by their actions. Frodo, the nominal hero, spends much of his time peering over and around things, watching others decide his fate, and occasionally gazing significantly upon the Ring. Sam is his loyal sidekick on the sidelines. Merry and Pippin spend a climactic stretch of the movie riding in Treebeard's branches and looking goggle-eyed at everything, like children carried on their father's shoulders. The fellowship of the first movie has been divided into three during this one, and most of the action centers on Aragorn, who operates within the tradition of Viking swordsmen and medieval knights.
The details of the story--who is who, and why, and what their histories and attributes are--still remains somewhat murky to me. I know the general outlines and I boned up by rewatching the first film on DVD the night before seeing the second, and yet I am in awe of the true students of the Ring. For the amateur viewer, which is to say for most of us, the appeal of the movies is in the visuals. Here there be vast caverns and mighty towers, dwarves and elves and Orcs and the aforementioned Uruk-Hai (who look like distant cousins of the aliens in ""Battlefield Earth""). And all are set within Jackson's ambitious canvas and backdropped by spectacular New Zealand scenery.
""The Two Towers"" will possibly be more popular than the first film, more of an audience-pleaser, but hasn't Jackson lost the original purpose of the story somewhere along the way? He has taken an enchanting and unique work of literature and retold it in the terms of the modern action picture. If Tolkien had wanted to write about a race of supermen, he would have written a Middle-Earth version of ""Conan the Barbarian."" But no. He told a tale in which modest little hobbits were the heroes. And now Jackson has steered the story into the action mainstream. To do what he has done in this film must have been awesomely difficult, and he deserves applause, but to remain true to Tolkien would have been more difficult, and braver."
10122,"Pirates of the Caribbean': Eat My Jetsam, Davy Jon","AT first glance, it seems like a pretty good deal. You put down your money — still less than $10 in most cities — and in return you get two and a half hours of spirited swashbuckling, with an all-star three-way battle of the cheekbones (Orlando Bloom vs. Keira Knightley vs. Johnny Depp) and some extra-slimy computer-generated imagery thrown in at no additional cost. But there's a catch, as there usually is. ""Pirates of the Caribbean: Dead Man's Chest"" is not just a movie. It's a glistening, sushi-grade chunk of franchise entertainment, which means that maximal enjoyment of it comes with certain obligations. It is the second episode in what will be at least a trilogy — the third installment is scheduled for release next summer — and full appreciation of its whirligig plot will depend on thorough acquaintance with the first ""Pirates of the Caribbean"" picture, conveniently available for purchase on DVD. And since ""Dead Man's Chest"" brazenly dispenses with the convention of an ending — it's pretty much all middle — you will, by virtue of buying that ticket, have committed yourself to buying another one a year from now if you're the least bit curious about how the whole thing turns out. By then, chances are good that you will have forgotten most of what happened in ""Dead Man's Chest,"" so you'll have another disc to add to the shopping cart.  The question is: Is it worth it? The same thought probably crosses the minds of Disney theme-park vacationers as they endure endless lines for the ride on which the movies are based, but the notion is quickly banished because nobody likes to feel like a sucker. By a rational calculation of time and money — yours and the untold millions invested by Disney, the producer Jerry Bruckheimer and others — the answer is probably no. But hey, this isn't about that, right? It's about fun. You're there to have fun. Fun for the family. Fun for the kids. Fun for everyone. So shut up and have fun.  And you probably will, even if it's hard to shake the feeling that you've been bullied into it. Gore Verbinski, the director, has an appropriate sense of mischief, as a well as a gift, nearly equaling those of Peter Jackson and Steven Spielberg, for integrating CGI seamlessly into his cinematic compositions. What is curious about the recent crop of high-tech blockbusters is how seriously they take themselves, and unlike, say, ""Superman Returns,"" ""Dead Man's Chest"" cannot be called pretentious. It makes no claims to being about good and evil, the difficulty of saving the world in the modern era, or the inner lives of any of its characters.  Instead, it sends Elizabeth Swann (Ms. Knightley) and Will Turner (Mr. Bloom), their wedding day ruined in an opening sequence that seems to pay tribute to the old Guns N' Roses ""November Rain"" video, on a search for the pirate captain Jack Sparrow (Mr. Depp). Jack, as usual, finds himself in all kinds of trouble, pursued not only by agents of the British crown, but also by an undead, squid-faced mariner, the famous Davy Jones, who commands a ghoulish crew of half-human, half-aquatic creatures. These sailors are like the cast of ""SpongeBob SquarePants"" — or the menu at a seafood restaurant —come to life: Night of the Living Bouillabaisse.  One of them, played by Stellan Skarsgard with a starfish embedded in his face, is Will's long-lost father, a development that adds a gelatinous morsel of father-son pathos to the stew of plots and subplots cooked up by the screenwriters, Ted Elliott and Terry Rossio. Davy Jones himself, meanwhile, speaks in the sinister whisper of Bill Nighy, though it is his swaying mass of facial tentacles that most viewers will remember.  And there are other memorable bits and pieces, visual highlights of a movie with no particular interest in coherence, economy or feeling. Ms. Knightley is, once again, a vision of imperial British pluckiness, with an intriguing dash of romantic recklessness that surfaces toward the end. Mr. Bloom, as is his custom, leaps about, trying to overcome his incurable blandness, and is upstaged by special effects, musical cues, octopus tentacles and pieces of wood. Naomie Harris turns up for a few scenes of hammy voodoo, and Mackenzie Crook and David Bailie contribute some proletarian slapstick. Most of the other members of the first movie's cast show up again, sometimes in surprising circumstances.  The franchise, of course, belongs to Jack Sparrow, and to Mr. Depp. Because this is a sequel, the role is no longer the splendid surprise it was in 2003, when ""The Curse of the Black Pearl"" charmed audiences and disarmed critics on its way to the third-best domestic box-office gross of the year. But the best parts of ""Dead Man's Chest"" confirm Jack Sparrow as the most viable Disney cartoon character in quite some time, though his anarchic insouciance has more in common with the work of Chuck Jones or Tex Avery. Mr. Verbinski, for his part, grasps the kinship between today's computer-assisted filmmaking and the hand-drawn animation of old, which lies in the freedom to revise the laws of physics at will. Two sequences in particular stand out, and would stand alone nicely as shorts: I will always think of them as ""Fruit Kebab"" and ""Runaway Hamster Wheel.""  But the easy delight that such flights of visual fancy inspires is crowded and blocked by all the other stuff going on in this long, ungainly movie, which for all its busy, buzzing parts, is incapable of standing on its own. It batters you with novelty and works so hard to top itself that exhaustion sets in long before the second hour is over. By next summer, I suppose, we'll all be rested and ready for more."
10123,"Star Trek the Motion Picture (1979)
The Screen: 'S","""Star Trek,"" the popular television series that died 10 years ago but would not be forgotten, has, like Lazarus, come back to haunt the skeptical and reassure all those who have kept the faith. It's called ""Star Trek — the Motion Picture,"" rather superfluously, I think, because I doubt anyone who sees it could possibly confuse this film with those shards of an earlier, simpler, cheaper television era.

Watching ""Star Trek — the Motion Picture,"" which opens today at Loews Orpheum and other theaters, is like attending your high-school class's 10th reunion at Caesar's Palace. Most of the faces are familiar, but the décor has little relationship to anything you've ever seen before. Among the friends are good old Captain Kirk (William Shatner), commanding officer of the Starship Enterprise; pointy-eared Mr. Spock (Leonard Nimoy), whose humanity disqualifies him from attaining ""kolinahr,"" the state of grace on his native planet Vulcan; Dr. McCoy (DeForest Kelley), the spaceship's general practitioner, nicknamed ""Bones,"" just as he might have been on H.M.S. Bounty, and such other reliables as Scotty (James Doohan), the engineering officer, and Sulu (George Takei), the ship's helmsman.

The newcomers are Stephen Collins, who plays Commander Decker, the Enterprise's stalwart young executive officer, and Perris Khambatta, an actress from India who plays Ilia, a shockingly beautiful young woman whose head has been shaved as clean as a whistle in the fashion of her home-planet, Delta Four.

This time out the mission of the Enterprise is to intercept a mysterious cloud, which is apparently light years in diameter and is heading toward earth for reasons that not even Mr. Spock can divine. It's not revealing a secret to tell you that the cloud contains what is usually referred to under such circumstances as ""a superior intelligence,"" though just what that intelligence is must remain one of the film's few witty surprises.

I suspect that wit is not what ""Star Trek"" fans are looking for. Instead they want to see favorite characters who are as ageless and multidimensional as characters in a comic strip, and not at all ashamed of those origins. The dialogue — at least what dialogue one can hear over Jerry Goldsmith's music and the sounds of rockets being fired — is of a banality that soothes the weary mind, like Magic Fingers that work on a tired brain. Unlike ""Star Wars,"" which was full of conscious associations to other literature, ""Star Trek"" refers only to itself, with the possible exception of the climactic sequence that borrows freely from Christian myth.

The film's vision of the future, which is a bit tacky at the beginning, becomes increasingly hypnotic as the movie goes on, or maybe it just seems that way as one falls under the spell of so many abstract patterns of light and color, designed to simulate the experiences of the members of the Enterprise crew as they pass through various dimensions of time and space.

""Star Trek"" is yet another film that owes more to Douglas Trumbull and John Dykstra, who did the special photographic effects, and to Harold Michelson, the production designer, than it does to the director, the writers or even the producer, Gene Roddenberry, who also created and produced the television series.

The formidable Robert Wise, who once directed a good, pacifist sci-fi film, ""The Day the Earth Stood Still"" (1951), a film with very few special effects, directed ""Star Trek,"" but I can't imagine what there was for him to do after telling the actors where to stand. Because most of the drama in such a movie is created in the laboratories, the actors are limited to the exchanging of meaningful glances or staring intently at television monitors, usually in disbelief.

"
