Review_ReviewID,ReviewTitle,ReviewContent
10131,"Screen: 'Alien 'Brings Chills From the Far Galaxy:","A GIGANTIC construction moves serenely through space where, though the night never ends, there's always enough light to see strange objects. This one looks like the main set of D.W. Griffith's ""Intolerance."" It's as if Babylon had been cut loose from earth to sail back through space to its own time. In actual fact, it's the cargo-ship Nostromo on its return to earth at the end of an extended voyage to the far end of the galaxy.

When we go inside, the ship appears to have been as suddenly deserted as the Marie Celeste. We wander down empty corridors into abandoned living quarters, into engine rooms and, finally, into the command room where the computers are the only signs of life. The interior of the ship is vast. It contains the kind of waste space one seldom sees anymore except in some rare old Manhattan pile like the Dakota. Something decidedly eerie is going on.

Thus — familiarly but with immense promise — begins ""Alien,"" Ridley Scott's new, elaborately produced science-fiction film that opens today at the Criterion and other theaters. However, as this voyage continues, familiarity consumes the promise and leaves as residue the memory of some shrieks from shocks of a most mundane kind.

The crew of the Nostromo has not vanished. They are merely sleeping the time away and, shortly after the opening credits, they come forth from their sleep-pods to prepare for their re-entry into the earth's orbit. It's then that they encounter peculiar signals from the wreck of another space ship, one from another galaxy and one which has crashed onto an uncharted planetoid. The Nostromo stops to investigate, locates the craft and, when it takes off again for earth, it carries aboard a specimen of alien life, a small, octopus-like blob that won't stop growing and — possibly worse — is ""unclouded by conscience or delusions of morality.""

That's about all one should or can say about the story originally conceived by Dan O'Bannon and turned into a screenplay by him and Ronald Shusett.

""Alien"" is an extremely small, rather decent movie of its modest kind, set inside a large, extremely fancy physical production. Don't race to it expecting the wit of ""Star Wars"" or the metaphysical pretentions of ""2001"" and ""Close Encounters of the Third Kind."" At its best it recalls ""The Thing,"" though the Howard Hawks film was both more imaginatively and more economically dramatized.

It's an old-fashioned scare movie about something that is not only implacably evil but prone to jumping out at you when (the movie hopes) you least expect it. There was once a time when this sort of thing was set in an old dark house, on a moor, in a thunderstorm. Being trendy, Mr. Scott and his associates have sent it up in space.

As he demonstrated with ""The Duellists,"" his first feature, Mr. Scott is a very stylish director. Though ""Alien"" is not the seminal science-fiction film one wants from him, it's executed with a good deal of no-nonsense verve. The members of the small cast are uniformly good though, with two exception, the roles might have been written by a computor.

Sigourney Weaver is impressive and funny as the Nostromo's executive officer, the second in command, a young woman who manages to act tough, efficient and sexy all at the same time. Ian Holm is also excellent as the ship's science officer, a man with a secret that will set him apart from everyone else forever.

Other members of the crew are played by Tom Skerritt, Harry Dean Stanton, Yaphet Kotto and Veronica Cartwright, the actress who was so good in ""Invasion of the Body Snatchers."" She plays a somewhat similar role here, one that requires her to weep a lot and leaves her so red-eyed and red-nosed that she may be in danger of becoming the Isable Jewell of the living-color space-age.

""Alien's"" sets and special effects are well done, but these things no longer surprise or tantalize us as they once did. In a very short time, science-fiction films have developed their own jargon that's now become a part of the grammar of film. You know the sort of stuff I mean — the shots of blinking instrument panels, of wildly bleeping computers, of cryptic messages clattering in square type-faces across televisio screens. There's also the obligatory shot of that huge space vehicle early on in every film. It appears from over our right shoulder, passes over our head and then proceeds slowly and majestically toward the far distance at screen-left. When I first saw it in ""2001,"" it was awesome. Now it makes me feel like a turtle on a busy though unnaturally quiet highway."
10132,BRAVEHEART,"Mel Gibson's ""Braveheart"" is a full-throated, red-blooded battle epic about William Wallace, the legendary Scots warrior who led his nation into battle against the English in the years around 1300. It's an ambitious film, big on simple emotions like love, patriotism and treachery, and avoids the travelogue style of so many historical swashbucklers: Its locations look green, wet, vast, muddy and rugged.
Not much is known about Wallace, known as Braveheart, except that according to an old epic poem, he unified the clans of Scotland and won famous battles against the English before being captured, tortured and executed as a traitor.
Wallace's dying cry, as his body was stretched on the rack, was ""freedom!"" That isn't exactly based on fact (the concept of personal freedom was a concept not much celebrated in 1300), but it doesn't stop Gibson from making it his dying cry. It fits in with the whole glorious sweep of ""Braveheart,"" which is an action epic with the spirit of the Hollywood swordplay classics and the grungy ferocity of ""The Road Warrior."" What people are going to remember from the film are the battle scenes, which are frequent, bloody and violent. Just from a technical point of view, ""Braveheart"" does a brilliant job of massing men and horses for large-scale warfare on film. Gibson deploys what look like thousands of men on horseback, as well as foot soldiers, archers and dirty tricks specialists, and yet his battle sequences don't turn into confusing crowd scenes: We understand the strategy, and we enjoy the tactics even while we're doubting some of them (did 14th century Scots really set battlefields aflame?).
Gibson is not filming history here, but myth. William Wallace may have been a real person, but ""Braveheart"" owes more to Prince Valiant, Rob Roy and Mad Max. Once we understand that this is not a solemn historical reconstruction (and that happens pretty fast), we accept dialogue that might otherwise have an uncannily modern tone, as when Braveheart issues his victory ultimatum to the English: ""Scotland's terms are that your commander present himself in front of our army, put his head between his legs and kiss his - - -."" Uh, huh.
In the film, Wallace's chief antagonist is King Edward I (""Longshanks""), played by Patrick McGoohan with sly cunning; he is constantly giving his realpolitik interpretation of events, and that's all the more amusing since he's usually guessing wrong.
Edward's son, the Prince of Wales (Peter Hanly), is an effete fop who marries a French woman only for political reasons. ""I may have to conceive the child myself!"" Longshanks says, and indeed, under the medieval concept of prima nocte, or ""first night,"" nobles were allowed a first chance to sleep with the wives of their lessers.
The Princess, played by the French actress Sophie Marceau, does not much admire her husband, who spends most of his time hanging about moon-eyed with his best friend (until the king, in a fit of impatience, hurls the friend out the castle window).
Edward, smarting from defeats, dispatches the Princess to offer his terms to Braveheart, but soon she's spilling all the state secrets, ""because of the way you look at me."" The Princess is the second love in Wallace's life; the first, his childhood sweetheart Murron (Catherine McCormack), marries him in secret (so the local English lord won't claim his rights). The two spend their wedding night outdoors, and the backlit shot as they embrace gains something, I think, from the frost on their breaths.
These characters come from hardened stock. (When Wallace has a reunion with his childhood pal Hamish, they hurl rocks at each other for entertainment; later, when a Scotsman has his wound cauterized, all he says is, ""That'll wake you up in the morning, boy!"") It is sometimes seen as an egotistical gesture when actors direct themselves, especially in heroic epics costing (so they say) $53 million. The truth is, given this material, I do not know that anyone could have directed it better. Gibson marshals his armies of extras, his stunt men and his special effects, and creates a fictional world that is entertaining, and thrilling.
And as Braveheart, Gibson plays his role with flamboyance, and cuts it with sly humor. He is an amazing battlefield strategist, inventing new strategies and weapons, outsmarting the English at every turn, leading his men into battle with his face painted blue, like a football fan. There is a scene where he is so pumped up with the scent of battle that his nostrils flare; not many actors could get away with that, but Gibson can."
10133,"BATMAN BEGINS","'Batman Begins"" at last penetrates to the dark and troubled depths of the Batman legend, creating a superhero who, if not plausible, is at least persuasive as a man driven to dress like a bat and become a vigilante. The movie doesn't simply supply Batman's beginnings in the tradition of a comic book origin story, but explores the tortured path that led Bruce Wayne from a parentless childhood to a friendless adult existence. The movie is not realistic, because how could it be, but it acts as if it is.
Opening in a prison camp in an unnamed nation, ""Batman Begins"" shows Bruce Wayne (Christian Bale) enduring brutal treatment as a prisoner, as part of his research into the nature of evil. He is rescued by the mysterious Henri Ducard (Liam Neeson), who appoints himself Wayne's mentor, teaches him sword-fighting and mind control, and tries to enlist him in his amoral League of Shadows (""We burned London to the ground"").
When Wayne refuses to kill someone as a membership requirement, Ducard becomes his enemy; the reclusive millionaire returns to Gotham City determined to fight evil, without realizing quite how much trouble he is in.
The story of why he identifies with bats (childhood trauma) and hates evildoers (he saw his parents killed by a mugger) has been referred to many times in the various incarnations of the Batman legend, including four previous films. This time, it is given weight and depth. Wayne discovers in Gotham that the family Wayne Corp. is run by a venal corporate monster (Rutger Hauer), but that in its depths labors the almost forgotten scientific genius Lucius Fox (Morgan Freeman), who understands Wayne wants to fight crime and offers him the weaponry.
Lucius happens to have on hand a prototype Batmobile, which unlike the streamlined models in the earlier movies, is a big, unlovely juggernaut that looks like a Humvee's wet dream. He also devises a bat-cape with surprising properties.
These preparations, Gotham crime details and the counsel of the faithful servant Alfred (Michael Caine) delay the actual appearance of Batman until the second act of the movie. We don't mind. Unlike the earlier films, which delighted in extravagant special-effects action, ""Batman Begins"" is shrouded in shadow; instead of high-detail, sharp-edged special effects, we get obscure developments in fog and smoke, reinforced by a superb sound-effects design. And Wayne himself is a slow learner, clumsy at times, taking foolish chances, inventing Batman as he goes along.
This is at last the Batman movie I've been waiting for. The character resonates more deeply with me than the other comic superheroes, perhaps because when I discovered him as a child, he seemed darker and more grown-up than the cheerful Superman. He has secrets. As Alfred muses: ""Strange injuries and a nonexistent social life. These things beg the question, what does Bruce Wayne do with his time?""
What he does is create a high profile as a millionaire playboy who gets drunk and causes scenes. This disappoints Rachel Dawes (Katie Holmes), his friend since childhood, who is now an assistant D.A. She and Lt. James Gordon (Gary Oldman), apparently Gotham City's only honest cop, are faced with a local crime syndicate led by Carmine Falcone (Tom Wilkinson). But Falcone's gang is child's play, compared to the deep scheme being hatched by the corrupt psychiatrist Dr. Jonathan Crane (Cillian Murphy), who, in the tradition of Victorian alienists, likes to declare his enemies insane and lock them up.
Crane's secret identity as the Scarecrow fits into a scheme to lace the Gotham water supply with a psychedelic drug. Then a superweapon will be used to vaporize the water, citizens will inhale the drug, and it will drive them crazy, for reasons which the Scarecrow and his confederates explain with more detail than clarity. Meanwhile, flashbacks establish the character's deepest traumas, including his special relationship with bats and his guilt because he thinks he is responsible for his parents' mugging.
I admire, among other things, the way the movie doesn't have the gloss of the earlier films. The Batman costume is an early design. The Bat Cave is an actual cave beneath Wayne Manor. The Batmobile enters and leaves it by leaping across a chasm and through a waterfall. The Bat Signal is crude and out of focus.
The movie was shot on location in Chicago, making good use of the murky depths of lower Wacker Drive and the Board of Trade building (now the Wayne Corp.). Special effects add a spectacular monorail down La Salle Street, which derails in the best scene along those lines since ""The Fugitive.""
Bale is just right for this emerging version of Batman. It's strange to see him muscular and toned, after his cadaverous appearance in ""The Machinist,"" but he suggests an inward quality that suits the character. Rachel is at first fooled by his facade of playboy irresponsibility, but Lt. Gordon figures out fairly quickly what Batman is doing, and why. Instead of one villain as the headliner, ""Batman Begins"" has a whole population, including Falcone, the Scarecrow, the Asian League of Shadows leader Ra's Al Ghul (Ken Watanabe) and a surprise bonus pick.
The movie has been directed by Christopher Nolan, still only 35, whose ""Memento"" (2000) took Sundance by storm and was followed by ""Insomnia"" (2002), a police procedural with Al Pacino. What Warner Bros. saw in those pictures that inspired them to think of Nolan is hard to say, but the studio guessed correctly, and after an eight-year hiatus, the Batman franchise has finally found its way.
I said this is the Batman movie I've been waiting for; more correctly, this is the movie I did not realize I was waiting for, because I didn't realize that more emphasis on story and character and less emphasis on high-tech action was just what was needed. The movie works dramatically in addition to being an entertainment. There's something to it."
10134,"The Godfather Part III","Francis Ford Coppola's ""The Godfather Part III"" isn't just a disappointment, it's a failure of heartbreaking proportions. Admittedly, ""The Godfather"" I and II, which are universally acclaimed as among the greatest works of the American cinema, are a tough act to follow; a very good film might be put alongside them and still not measure up. ""Godfather III,"" though, adds little more than a sad footnote to those earlier works.

The film completes the story of Vito Corleone and his sons, bringing us from the point at which the second film ended to the present day, from that image of an isolated Michael (Al Pacino) looking out from his boathouse office as the orders for his brother's murder are executed, to the anticlimactic ending. But in supplying the final chapter of the saga, it also sullies what came before. It makes you wish it had never been made.

Coppola's star has dimmed significantly over the 16 years since the last ""Godfather"" film, but to see this third installment is to watch it fall out of the sky altogether. ""The Godfather Part III"" is the work of an artist estranged from his talent, a lost soul. In continuing the story of the Corleones, not only does Coppola fail to build on what he and his screenwriter Mario Puzo previously created; he also seems oblivious to what had made his story so compelling to begin with.

The characters that carry over from the earlier films bear little resemblance to themselves. The dread curve of Michael Corleone's life, which provided a dramatic spine for the family saga, has lost its sinister bend. At the beginning of ""Part III,"" Michael has come very close to realizing his dream of a completely legitimate family business. At a ceremony in his New York penthouse, he receives the Order of St. Sebastian from the Catholic Church, a lofty honor that may be connected to the $100 million donation given to the church by the Vito Corleone Foundation, a charity run by Michael's daughter Mary (Sofia Coppola). But this first act doesn't have the dramatic resonance of the wedding scene in ""Part I,"" or the celebration of Michael's son Anthony's first communion in ""Part II,"" because Michael no longer sits like a malignant spider at the center of his Mafia web. Michael is a businessman now, and in divesting himself of his criminal interests he has lost what made him interesting, his murderous darkness.

It's nearly impossible to see how the relentlessly brutal middle-aged man at the end of ""Part II"" could have grown into the relaxed, polished, easy-moving older one we see here. In some scenes -- like one in which he urges Vincent (Andy Garcia), his brother Sonny's hotheaded bastard son, to make the peace with a rival, Joey Zaza (Joe Mantegna) -- he seems almost charming -- a smiling, glad-handing lightweight. The action here takes place past the point where there is anything at stake, and it has, at times, an almost meditative quality, an old man's summing up.

With Michael missing from the film's center, the rest of the action seems ungrounded; it loses its moral dimension and becomes just another mob story. The two main plot threads concern the Corleone family's dealing with the Vatican, and Vincent's emergence as Michael's successor. The motives for Garcia's Vincent aren't split, the way Michael's have been. Violence is natural to him. He suffers no pangs of conscience when he takes revenge on his family's behalf, and in this he is supposed to be strong in the uncomplicated way Don Vito Corleone was. Garcia, as a result, seems to be the only actor in the film who knows what he's playing, the only one with a clear mission, and he gives a thrilling, feral performance. It's the film's strongest.

Pacino, for his part, flails around inside his character. His makeup is superb, though if he had been allowed to sweep back his hair it might have connected him physically to Garcia (and to Marlon Brando and Robert De Niro, as well). Sometimes his choices are intriguing, and at times he draws something interesting to the surface of his performance. For the most part, though, he busies himself by paying attention to the details of playing an older man -- Michael is around 60 -- and goes not much deeper than that.

Some of Coppola's choices -- for example, having Michael collapse suddenly into a diabetic coma when it was never mentioned that he suffers from the disease -- appear to have been made out of desperation. And some of the plotting -- particularly the handling of a conflict between the Corleones and the Luchese family over control of the Vatican's massive corporate holdings -- is tangled beyond comprehension. Some scenes -- such as the ones with Diane Keaton as Michael's wife, Kay -- are in the film because of studio politics, and not because Puzo and Coppola have anything of importance to say in them.

Even though she is authoritative in the role, Keaton suffers tremendously from having no real function except to nag Michael for his past sins. (She's also anchored with some of the film's most painful dialogue.) Eli Wallach has a few hammy moments as Don Altabello, an old mob friend who turns out to be an enemy. Bridget Fonda, who plays a journalist, has only two small scenes that contribute nothing whatsoever, and George Hamilton contributes a few atrocious moments as the family's PR man. Talia Shire's part as Michael's sister, Connie, has been expanded in ""Part III,"" but the conception for the character seems to vary from scene to scene, so that at one moment she's a screaming crackpot and the next a power-hungry behind-the-scenes plotter.

The romance between Mary and Vincent is one of the film's main subplots, and as Mary, Sofia Coppola is hopelessly amateurish. Still, the part is a relatively small one, and her failure -- contrary to much that has already been written -- contributes very little to what is actually wrong with the film.

It may be that Coppola was right to put off filing this last installment all these years; from the evidence here, he had nothing more to say. As an epic metaphor for the American dream, the first two ""Godfather"" films are nearly perfect. The connections they made go deep into the story of this country, deep into our sense of ourselves and the contradictions in our lives. As a generational story, they had the richness and scope of Shakespeare. But the man who made those two masterpieces is not the man who has given us this failed final chapter. Though he reassembled many of the members of his old team -- his actors, Puzo, cinematographer Gordon Willis and production designer Dean Tavoularis -- his talent for filmmaking is eclipsed now by his gift for self-destruction. If that great earlier artist ever had a chance of resurfacing, it was here. But he didn't and you can't help but see ""The Godfather Part III"" as his headstone."
