MovieID,MovieName,RunTime,ReleaseDate,Language,Rating,Vote_count,Plot,Poster,ImdbID
11,"Star Wars: Episode IV - A New Hope",121,1977-05-25,English,7.50,2020,"Princess Leia is captured and held hostage by the evil Imperial forces in their effort to take over the galactic Empire. Venturesome Luke Skywalker and dashing captain Han Solo team together with the loveable robot duo R2-D2 and C-3PO to rescue the beautiful princess and restore peace and justice in the Empire.",http://ia.media-imdb.com/images/M/MV5BMTU4NTczODkwM15BMl5BanBnXkFtZTcwMzEyMTIyMw@@._V1_SX300.jpg,tt0076759
12,"Finding Nemo",100,2003-05-30,English,7.00,1832,"A tale which follows the comedic and eventful journeys of two fish, the fretful Marlin and his young son Nemo, who are separated from each other in the Great Barrier Reef when Nemo is unexpectedly taken from his home and thrust into a fish tank in a dentist's office overlooking Sydney Harbor. Buoyed by the companionship of a friendly but forgetful fish named Dory, the overly cautious Marlin embarks on a dangerous trek and finds himself the unlikely hero of an epic journey to rescue his son.",http://ia.media-imdb.com/images/M/MV5BMTY1MTg1NDAxOV5BMl5BanBnXkFtZTcwMjg1MDI5Nw@@._V1_SX300.jpg,tt0266543
13,"Forrest Gump",142,1994-06-22,English,7.50,2033,"A man with a low IQ has accomplished great things in his life and been present during significant historic events - in each case, far exceeding what anyone imagined he could do. Yet, despite all the things he has attained, his one true love eludes him. 'Forrest Gump' is the story of a man who rose above his challenges, and who proved that determination, courage, and love are more important than ability.",http://ia.media-imdb.com/images/M/MV5BMTQwMTA5MzI1MF5BMl5BanBnXkFtZTcwMzY5Mzg3OA@@._V1_SX300.jpg,tt0109830
18,"The Fifth Element",126,1997-05-09,English,6.80,1435,"It’s the year 2257 and a taxi driver has been unintentionally given the task of saving a young girl who is part of the key that will ensure the survival of humanity. The Fifth Element is filmed in a futuristic metropolitan city and in a French comic book asthetic by a controversial British, French and American lineup.",http://ia.media-imdb.com/images/M/MV5BMTkzOTkwNTI4N15BMl5BanBnXkFtZTYwMDIzNzI5._V1_SX300.jpg,tt0119116
22,"Pirates of the Caribbean: The Curse of the Bl",143,2003-07-09,English,6.90,2027,"Jack Sparrow, a freewheeling 17th-century pirate who roams the Caribbean Sea butts heads with a rival pirate bent on pillaging the village of Port Royal. When the governor's daughter is kidnapped, Sparrow decides to help the girl's love save her. But their seafaring mission is hardly simple.",http://ia.media-imdb.com/images/M/MV5BMjAyNDM4MTc2N15BMl5BanBnXkFtZTYwNDk0Mjc3._V1_SX300.jpg,tt0325980
58,"Pirates of the Caribbean: Dead Man's Chest",151,2006-07-07,English,6.50,1558,"The high-seas adventures of happy-go-lucky troublemaker Captain Jack Sparrow, young Will Turner and headstrong beauty Elizabeth Swann continues as Sparrow works his way out of a blood debt with the ghostly Davey Jones, he also attempts to avoid eternal damnation.",http://ia.media-imdb.com/images/M/MV5BMTcwODc1MTMxM15BMl5BanBnXkFtZTYwMDg1NzY3._V1_SX300.jpg,tt0383574
78,"Blade Runner",117,1982-06-25,English,7.50,946,"In the smog-choked dystopian Los Angeles of 2019, blade runner Rick Deckard is called out of retirement to kill a quartet of replicants who have escaped to Earth seeking their creator for a way to extend their short life spans.",http://ia.media-imdb.com/images/M/MV5BMTA4MDQxNTk2NDheQTJeQWpwZ15BbWU3MDE2NjIyODk@._V1_SX300.jpg,tt0083658
82,"Miami Vice",134,2006-07-27,English,5.40,57,"Miami Vice is an feature film based on the 1980's action drama TV series. The film tells the story of vice detectives Crockett and Tubbs and how their personal and professional lives are dangerously getting mixed.",http://ia.media-imdb.com/images/M/MV5BMTM4MDQ5MTkxMV5BMl5BanBnXkFtZTcwMTU4MzUzMQ@@._V1_SX300.jpg,tt0430357
85,"Raiders of the Lost Ark",115,1981-06-12,English,7.10,1394,"When Dr. Indiana Jones – the tweed-suited professor who just happens to be a celebrated archaeologist – is hired by the government to locate the legendary Ark of the Covenant, he finds himself up against the entire Nazi regime.",http://ia.media-imdb.com/images/M/MV5BMjA0ODEzMTc1Nl5BMl5BanBnXkFtZTcwODM2MjAxNA@@._V1_SX300.jpg,tt0082971
89,"Indiana Jones and the Last Crusade",127,1989-05-24,English,7.10,1093,"When Dr. Henry Jones Sr. suddenly goes missing while pursuing the Holy Grail, eminent archaeologist Indiana Jones must team up with Marcus Brody, Sallah, and Elsa Schneider to follow in his father's footsteps and stop the Nazis from recovering the power of eternal life.",http://ia.media-imdb.com/images/M/MV5BMTQxMTUyODg2OF5BMl5BanBnXkFtZTcwNDM2MjAxNA@@._V1_SX300.jpg,tt0097576
98,Gladiator,155,2000-05-01,English,7.20,1901,"Gladiator is an epic film of love, death and betrayal set in the Roman Empire. General Maximus' success in battle earns the favour of an elderly Emperor at the expense of the Emperor's son. In a fit of jealous rage the son slays his father before turning his anger towards Maximus. Now reduced to a slave, his family dead, Maximus must fight as a Gladiator to gain his freedom, and his revenge.",http://ia.media-imdb.com/images/M/MV5BMTgwMzQzNTQ1Ml5BMl5BanBnXkFtZTgwMDY2NTYxMTE@._V1_SX300.jpg,tt0172495
105,"Back to the Future",116,1985-07-03,English,7.30,1809,"Eighties teenager Marty McFly is accidentally sent back in time to 1955, inadvertently disrupting his parents' first meeting and attracting his mother's romantic interest. Marty must repair the damage to history by rekindling his parents' romance and - with the help of his eccentric inventor friend Doc Brown - return to 1985.",http://ia.media-imdb.com/images/M/MV5BMTk4OTQ1OTMwN15BMl5BanBnXkFtZTcwOTIwMzM3MQ@@._V1_SX300.jpg,tt0088763
115,"The Big Lebowski",117,1998-03-06,English,7.30,631,"Jeffrey ""The Dude"" Lebowski is the ultimate LA slacker, until one day his house is broken into and his rug is peed on by two angry gangsters who have mistaken him for Jeffrey Lebowski, the LA millionaire, whose wife owes some bad people some big money. The Dude becomes entangled in the plot when he goes to visit the real Lebowski in order to get some retribution for his soiled rug, and is recruited to be the liason between Lebowski and the captors of his now ""kidnapped"" wife.",http://ia.media-imdb.com/images/M/MV5BMTQ0NjUzMDMyOF5BMl5BanBnXkFtZTgwODA1OTU0MDE@._V1_SX300.jpg,tt0118715
120,"The Lord of the Rings: The Fellowship of the ",178,2001-12-19,English,7.40,3393,"Young hobbit Frodo Baggins, after inheriting a mysterious ring from his uncle Bilbo, must leave his home in order to keep it from falling into the hands of its evil creator. Along the way, a fellowship is formed to protect the ringbearer and make sure that the ring arrives at its final destination: Mt. Doom, the only place where it can be destroyed.",http://ia.media-imdb.com/images/M/MV5BNTEyMjAwMDU1OV5BMl5BanBnXkFtZTcwNDQyNTkxMw@@._V1_SX300.jpg,tt0120737
121,"The Lord of the Rings: The Two Towers",179,2002-12-18,English,7.40,2764,"Frodo and Sam are trekking to Mordor to destroy the One Ring of Power while Gimli, Legolas and Aragorn search for the orc-captured Merry and Pippin. All along, nefarious wizard Saruman awaits the Fellowship members at the Orthanc Tower in Isengard.",http://ia.media-imdb.com/images/M/MV5BMTAyNDU0NjY4NTheQTJeQWpwZ15BbWU2MDk4MTY2Nw@@._V1_SX300.jpg,tt0167261
122,"The Lord of the Rings: The Return of the King",201,2003-12-17,English,7.50,3189,"Aragorn is revealed as the heir to the ancient kings as he, Gandalf and the other members of the broken fellowship struggle to save Gondor from Sauron's forces. Meanwhile, Frodo and Sam bring the ring closer to the heart of Mordor, the dark lord's realm.",http://ia.media-imdb.com/images/M/MV5BMjE4MjA1NTAyMV5BMl5BanBnXkFtZTcwNzM1NDQyMQ@@._V1_SX300.jpg,tt0167260
129,"Spirited Away",125,2001-07-20,Japanese,7.70,861,"Spirited Away is an Oscar winning Japanese animated film about a ten year old girl who wanders away from her parents along a path that leads to a world ruled by strange and unusual monster-like animals. Her parents have been changed into pigs along with others inside a bathhouse full of these creatures. Will she ever see the world how it once was?",http://ia.media-imdb.com/images/M/MV5BMjYxMDcyMzIzNl5BMl5BanBnXkFtZTYwNDg2MDU3._V1_SX300.jpg,tt0245429
152,"Star Trek: The Motion Picture",132,1979-12-06,English,6.20,120,"When a destructive space entity is spotted approaching Earth, Admiral Kirk resumes command of the Starship Enterprise in order to intercept, examine, and hopefully stop it.",http://ia.media-imdb.com/images/M/MV5BNzE4MTY1MTMyN15BMl5BanBnXkFtZTcwMzk5MzI4OA@@._V1_SX300.jpg,tt0079945
154,"Star Trek II: The Wrath of Khan",113,1982-06-03,English,7.00,170,"Admiral James T. Kirk is feeling old; the prospect of accompanying his old ship the Enterprise on a two week cadet cruise is not making him feel any younger. But the training cruise becomes a a life or death struggle when Khan escapes from years of exile and captures the power of creation itself.",http://ia.media-imdb.com/images/M/MV5BMTcwNjc5NjA4N15BMl5BanBnXkFtZTcwNDk5MzI4OA@@._V1_SX300.jpg,tt0084726
155,"The Dark Knight",152,2008-07-18,English,7.70,4679,"Batman raises the stakes in his war on crime. With the help of Lt. Jim Gordon and District Attorney Harvey Dent, Batman sets out to dismantle the remaining criminal organizations that plague the streets. The partnership proves to be effective, but they soon find themselves prey to a reign of chaos unleashed by a rising criminal mastermind known to the terrified citizens of Gotham as the Joker.",http://ia.media-imdb.com/images/M/MV5BMTMxNTMwODM0NF5BMl5BanBnXkFtZTcwODAyMTk2Mw@@._V1_SX300.jpg,tt0468569
161,"Ocean's Eleven",116,2001-12-06,English,6.80,1556,"Less than 24 hours into his parole, charismatic thief Danny Ocean is already rolling out his next plan: In one night, Danny's hand-picked crew of specialists will attempt to steal more than $150 million from three Las Vegas casinos. But to score the cash, Danny risks his chances of reconciling with ex-wife, Tess.",http://ia.media-imdb.com/images/M/MV5BMTY0Mzg4MzgwN15BMl5BanBnXkFtZTgwNDk0MzkxMDE@._V1_SX300.jpg,tt0240772
163,"Ocean's Twelve",125,2004-12-09,English,6.30,544,"Danny Ocean reunites with his old flame and the rest of his merry band of thieves in a caper concerning three huge heists in Rome, Paris and Amsterdam. But Europol agent Isabel Lahiri is hot on their heels.",http://ia.media-imdb.com/images/M/MV5BMTQ3NTIyMzczMF5BMl5BanBnXkFtZTYwMjgzNTg2._V1_SX300.jpg,tt0349903
197,Braveheart,177,1995-05-24,English,7.20,1204,"Enraged at the slaughter of Murron, his new bride and childhood love, legendary Scottish warrior William Wallace slays a platoon of the local English lord's soldiers. This leads the village to revolt and, eventually, the entire country to rise up against English rule.",http://ia.media-imdb.com/images/M/MV5BNjA4ODYxMDU3Nl5BMl5BanBnXkFtZTcwMzkzMTk3OA@@._V1_SX300.jpg,tt0112573
200,"Star Trek: Insurrection",103,1998-12-10,English,6.40,102,"When an alien race and factions within Starfleet attempt to take over a planet that has ""regenerative"" properties, it falls upon Captain Picard and the crew of the Enterprise to defend the planet's people as well as the very ideals upon which the Federation itself was founded.",http://ia.media-imdb.com/images/M/MV5BMjA3NDI5MzQ1OF5BMl5BanBnXkFtZTcwMzcxNDI4OA@@._V1_SX300.jpg,tt0120844
218,"The Terminator",108,1984-10-26,English,6.70,1235,"In the post-apocalyptic future, reigning tyrannical supercomputers teleport a cyborg assassin known as the ""Terminator"" back to 1984 to kill Sarah Connor, whose unborn son is destined to lead insurgents against 21st century mechanical hegemony. Meanwhile, the human-resistance movement dispatches a lone warrior to safeguard Sarah. Can he stop the virtually indestructible killing machine?",http://ia.media-imdb.com/images/M/MV5BODE1MDczNTUxOV5BMl5BanBnXkFtZTcwMTA0NDQyNA@@._V1_SX300.jpg,tt0088247
238,"The Godfather",175,1972-03-15,English,8.00,1986,"The story spans the years from 1945 to 1955 and chronicles the fictional Italian-American Corleone crime family. When organized crime family patriarch Vito Corleone barely survives an attempt on his life, his youngest son, Michael, steps in to take care of the would-be killers, launching a campaign of bloody revenge.",http://ia.media-imdb.com/images/M/MV5BMjEyMjcyNDI4MF5BMl5BanBnXkFtZTcwMDA5Mzg3OA@@._V1_SX300.jpg,tt0068646
240,"The Godfather: Part II",200,1974-12-20,English,7.80,999,"The continuing saga of the Corleone crime family tells the story of a young Vito Corleone growing up in Sicily and in 1910s New York; and follows Michael Corleone in the 1950s as he attempts to expand the family business into Las Vegas, Hollywood and Cuba",http://ia.media-imdb.com/images/M/MV5BNDc2NTM3MzU1Nl5BMl5BanBnXkFtZTcwMTA5Mzg3OA@@._V1_SX300.jpg,tt0071562
241,"Natural Born Killers",119,1994-08-25,English,6.70,139,"Two victims of traumatized childhoods become lovers and psychopathic serial murderers irresponsibly glorified by the mass media.",http://ia.media-imdb.com/images/M/MV5BMTI2NTU2Nzc0MV5BMl5BanBnXkFtZTcwMzY1OTM2MQ@@._V1_SX300.jpg,tt0110632
242,"The Godfather: Part III",162,1990-12-24,English,6.80,344,"In the midst of trying to legitimize his business dealings in 1979 New York and Italy, aging mafia don Michael Corleone seeks forgiveness for his sins while taking a young protege under his wing.",http://ia.media-imdb.com/images/M/MV5BMTU2MTA1NDMwNF5BMl5BanBnXkFtZTcwNjQzNDM5MQ@@._V1_SX300.jpg,tt0099674
272,"Batman Begins",140,2005-06-14,English,7.00,2491,"Driven by tragedy, billionaire Bruce Wayne dedicates his life to uncovering and defeating the corruption that plagues his home, Gotham City.  Unable to work within the system, he instead creates a new identity, a symbol of fear for the criminal underworld - The Batman.",http://ia.media-imdb.com/images/M/MV5BNTM3OTc0MzM2OV5BMl5BanBnXkFtZTYwNzUwMTI3._V1_SX300.jpg,tt0372784
277,Underworld,121,2003-09-19,English,6.30,906,"Vampires and werewolves have waged a nocturnal war against each other for centuries. But all bets are off when a female vampire warrior named Selene, who's famous for her strength and werewolf-hunting prowess, becomes smitten with a peace-loving male werewolf, Michael, who wants to end the war.",http://ia.media-imdb.com/images/M/MV5BMjIxNDExNDEyMV5BMl5BanBnXkFtZTcwODY1OTkxMw@@._V1_SX300.jpg,tt0320691
278,"The Shawshank Redemption",142,1994-09-14,English,8.00,3182,"Framed in the 1940s for the double murder of his wife and her lover, upstanding banker Andy Dufresne begins a new life at the Shawshank prison, where he puts his accounting skills to work for an amoral warden. During his long stretch in prison, Dufresne comes to be admired by the other inmates -- including an older prisoner named Red -- for his integrity and unquenchable sense of hope.",http://ia.media-imdb.com/images/M/MV5BODU4MjU4NjIwNl5BMl5BanBnXkFtZTgwMDU2MjEyMDE@._V1_SX300.jpg,tt0111161
280,"Terminator 2: Judgment Day",137,1991-07-01,English,7.00,1489,"Nearly 10 years have passed since Sarah Connor was targeted for termination by a cyborg from the future. Now her son, John, the future leader of the resistance, is the target for a newer, more deadly terminator. Once again, the resistance has managed to send a protector back to attempt to save John and his mother Sarah.",http://ia.media-imdb.com/images/M/MV5BMTg5NzUwMDU5NF5BMl5BanBnXkFtZTcwMjk2MDA4Mg@@._V1_SX300.jpg,tt0103064
285,"Pirates of the Caribbean: At World's End",169,2007-05-19,English,6.40,1124,"Captain Barbossa, long believed to be dead, has come back to life and is headed to the edge of the Earth with brave Will Turner and feisty Elizabeth Swann. And what of Jack Sparrow? Nothing is as it seems.",http://ia.media-imdb.com/images/M/MV5BMjIyNjkxNzEyMl5BMl5BanBnXkFtZTYwMjc3MDE3._V1_SX300.jpg,tt0449088
296,"Terminator 3: Rise of the Machines",109,2003-06-30,English,5.70,537,"It's been 10 years since John Connor saved Earth from Judgment Day, and he's now living under the radar, steering clear of using anything Skynet can trace. That is, until he encounters T-X, a robotic assassin ordered to finish what T-1000 started. Good thing Connor's former nemesis, the Terminator, is back to aid the now-adult Connor … just like he promised.",http://ia.media-imdb.com/images/M/MV5BMTk5NzM1ODgyN15BMl5BanBnXkFtZTcwMzA5MjAzMw@@._V1_SX300.jpg,tt0181852
329,"Jurassic Park",127,1993-06-08,English,6.80,1439,"A wealthy entrepreneur secretly creates a theme park featuring living dinosaurs drawn from prehistoric DNA. Before opening day, he invites a team of experts and his two eager grandchildren to experience the park and help calm anxious investors. However, the park is anything but amusing as the security systems go off-line and the dinosaurs escape.",http://ia.media-imdb.com/images/M/MV5BMjQzODQyMzk2Nl5BMl5BanBnXkFtZTcwNTg4MjQ3OA@@._V1_SX300.jpg,tt0107290
330,"The Lost World: Jurassic Park",129,1997-05-19,English,5.90,819,"Four years after Jurassic Park's genetically bred dinosaurs ran amok, multimillionaire John Hammond shocks chaos theorist Ian Malcolm by revealing that Hammond has been breeding more beasties at a secret location. Malcolm, his paleontologist ladylove and a wildlife videographer join an expedition to document the lethal lizards' natural behavior in this action-packed thriller.",http://ia.media-imdb.com/images/M/MV5BMTYxNjY1NjE2OV5BMl5BanBnXkFtZTYwNzE0MDc4._V1_SX300.jpg,tt0119567
331,"Jurassic Park III",92,2001-07-15,English,5.60,602,"In need of funds for research, Dr. Alan Grant accepts a large sum of money to accompany Paul and Amanda Kirby on an aerial tour of the infamous Isla Sorna. It isn't long before all hell breaks loose and the stranded wayfarers must fight for survival as a host of new -- and even more deadly -- dinosaurs try to make snacks of them.",http://ia.media-imdb.com/images/M/MV5BMjA2NzAyMDgyM15BMl5BanBnXkFtZTYwOTQ5Mjg5._V1_SX300.jpg,tt0163025
348,Alien,117,1979-05-25,English,7.10,1320,"During its return to the earth, commercial spaceship Nostromo intercepts a distress signal from a distant planet. When a three-member team of the crew discovers a chamber containing thousands of eggs on the planet, a creature inside one of the eggs attacks an explorer. The entire crew is unaware of the impending nightmare set to descend upon them when the alien parasite planted inside its unfortunate host is birthed.",http://ia.media-imdb.com/images/M/MV5BMTk3NzkwMjA3OV5BMl5BanBnXkFtZTYwMTIwOTk2._V1_SX300.jpg,tt0078748
425,"Ice Age",81,2002-03-15,English,6.50,977,"With the impending ice age almost upon them, a mismatched trio of prehistoric critters -- Manny the woolly mammoth, Diego the saber-toothed tiger and Sid the giant sloth -- find an orphaned infant and decide to return it to its human parents. Along the way, the unlikely allies become friends. But when enemies attack, their quest takes on far nobler aims..",http://ia.media-imdb.com/images/M/MV5BMjEyNzI1ODA0MF5BMl5BanBnXkFtZTYwODIxODY3._V1_SX300.jpg,tt0268380
453,"A Beautiful Mind",135,2001-12-12,English,6.80,562,"At Princeton University, John Nash struggles to make a worthwhile contribution to serve as his legacy to the world of mathematics. He finally makes a revolutionary breakthrough that will eventually earn him the Nobel Prize. After graduate school he turns to teaching, becoming romantically involved with his student Alicia. Meanwhile the government asks his help with breaking Soviet codes, which soon gets him involved in a terrifying conspiracy plot. Nash grows more and more paranoid until a discovery that turns his entire world upside down. Now it is only with Alicia's help that he will be able to recover his mental strength and regain his status as the great mathematician we know him as today.",http://ia.media-imdb.com/images/M/MV5BMTQ4MDI2MzkwMl5BMl5BanBnXkFtZTYwMjk0NTA5._V1_SX300.jpg,tt0268978
500,"Reservoir Dogs",99,1992-06-25,English,7.30,520,"A botched robbery indicates a police informant, and the pressure mounts in the aftermath at a warehouse. Crime begets violence as the survivors -- veteran Mr. White, newcomer Mr. Orange, psychopathic parolee Mr. Blonde, bickering weasel Mr. Pink and Nice Guy Eddie -- unravel.",http://ia.media-imdb.com/images/M/MV5BMTQxMTAwMDQ3Nl5BMl5BanBnXkFtZTcwODMwNTgzMQ@@._V1_SX300.jpg,tt0105236
510,"One Flew Over the Cuckoo's Nest",133,1975-11-18,English,7.50,591,"While serving time for insanity at a state mental hospital, implacable rabble-rouser Randle Patrick McMurphy inspires his fellow patients to rebel against the authoritarian rule of head nurse Mildred Ratched.",http://ia.media-imdb.com/images/M/MV5BMTk5OTA4NTc0NF5BMl5BanBnXkFtZTcwNzI5Mzg3OA@@._V1_SX300.jpg,tt0073486
534,"Terminator Salvation",115,2009-05-20,English,5.80,739,"All grown up in post-apocalyptic 2018, John Connor must lead the resistance of humans against the increasingly dominating militaristic robots. But when Marcus Wright appears, his existence confuses the mission as Connor tries to determine whether Wright has come from the future or the past -- and whether he's friend or foe.",http://ia.media-imdb.com/images/M/MV5BODE1MTM1MzA2NF5BMl5BanBnXkFtZTcwODQ5MTA2Mg@@._V1_SX300.jpg,tt0438488
550,"Fight Club",139,1999-10-14,English,7.60,2834,"A ticking-time-bomb insomniac and a slippery soap salesman channel primal male aggression into a shocking new form of therapy. Their concept catches on, with underground ""fight clubs"" forming in every town, until an eccentric gets in the way and ignites an out-of-control spiral toward oblivion.",http://ia.media-imdb.com/images/M/MV5BMjIwNTYzMzE1M15BMl5BanBnXkFtZTcwOTE5Mzg3OA@@._V1_SX300.jpg,tt0137523
557,Spider-Man,121,2002-05-02,English,6.20,1417,"After being bitten by a genetically altered spider, nerdy high school student Peter Parker is endowed with amazing powers.",http://ia.media-imdb.com/images/M/MV5BMzk3MTE5MDU5NV5BMl5BanBnXkFtZTYwMjY3NTY3._V1_SX300.jpg,tt0145487
558,"Spider-Man 2",127,2004-06-29,English,6.00,1240,"Peter Parker is going through a major identity crisis. Burned out from being Spider-Man, he decides to shelve his superhero alter ego, which leaves the city suffering in the wake of carnage left by the evil Doc Ock. In the meantime, Parker still can't act on his feelings for Mary Jane Watson, a girl he's loved since childhood.",http://ia.media-imdb.com/images/M/MV5BMjE1ODcyODYxMl5BMl5BanBnXkFtZTcwNjA1NDE3MQ@@._V1_SX300.jpg,tt0316654
559,"Spider-Man 3",139,2007-05-03,English,5.60,815,"The seemingly invincible Spider-Man goes up against an all-new crop of villains -- including the shape-shifting Sandman -- in the third installment of this blockbusting comic book adventure series. While Spidey's superpowers are altered by an alien organism, his alter ego, Peter Parker, deals with nemesis Eddie Brock and gets caught up in a love triangle.",http://ia.media-imdb.com/images/M/MV5BODUwMDc5Mzc5M15BMl5BanBnXkFtZTcwNDgzOTY0MQ@@._V1_SX300.jpg,tt0413300
562,"Die Hard",131,1988-07-14,English,6.80,1655,"NYPD cop John McClane's plan to reconcile with his estranged wife, Holly, is thrown for a serious loop when minutes after he arrives at her office, the entire building is overtaken by a group of pitiless terrorists. With little help from the LAPD, wisecracking McClane sets out to single-handedly rescue the hostages and bring the bad guys down.",http://ia.media-imdb.com/images/M/MV5BMTY4ODM0OTc2M15BMl5BanBnXkFtZTcwNzE0MTk3OA@@._V1_SX300.jpg,tt0095016
597,Titanic,194,1997-11-01,English,6.80,2320,"84 years later, a 101-year-old woman named Rose DeWitt Bukater tells the story to her granddaughter Lizzy Calvert, Brock Lovett, Lewis Bodine, Bobby Buell and Anatoly Mikailavich on the Keldysh about her life set in April 10th 1912, on a ship called Titanic when young Rose boards the departing ship with the upper-class passengers and her mother, Ruth DeWitt Bukater, and her fiancé, Caledon Hockley. Meanwhile, a drifter and artist named Jack Dawson and his best friend Fabrizio De Rossi win third-class tickets to the ship in a game. And she explains the whole story from departure until the death of Titanic on its first and last voyage April 15th, 1912 at 2:20 in the morning.",http://ia.media-imdb.com/images/M/MV5BMjExNzM0NDM0N15BMl5BanBnXkFtZTcwMzkxOTUwNw@@._V1_SX300.jpg,tt0120338
603,"The Matrix",136,1999-03-30,English,7.40,3668,"Thomas A. Anderson is a man living two lives. By day he is an average computer programmer and by night a malevolent hacker known as Neo, who finds himself targeted by the police when he is contacted by Morpheus, a legendary computer hacker, who reveals the shocking truth about our reality.",http://ia.media-imdb.com/images/M/MV5BMTkxNDYxOTA4M15BMl5BanBnXkFtZTgwNTk0NzQxMTE@._V1_SX300.jpg,tt0133093
646,"Dr. No",110,1962-10-05,English,6.30,203,"When Strangways, the British SIS Station Chief in Jamaica goes missing, MI6 send James Bond - Agent 007 to investigate. His investigation leads him to the mysterious Crab Key; the secret base of Dr No who he suspects is trying to sabotage the American space program using a radio beam. With the assistance of local fisherman Quarrel, who had been helping Strangways, Bond sneaks onto Crab Key where he meets the beautiful Honey Ryder. Can the three of them defeat an army of henchmen and a ""fire breathing dragon"" in order to stop Dr No, save the space program and get revenge for Strangways? Dr. No is the first film of legendary James Bond series starring Sean Connery in the role of Fleming's British super agent.",http://ia.media-imdb.com/images/M/MV5BOTU3NzExMTQ4N15BMl5BanBnXkFtZTcwMjkzNzQzNA@@._V1_SX300.jpg,tt0055928
