MovieID,MovieName,RunTime,ReleaseDate,Language,Rating,Vote_count,Plot,Poster,ImdbID
22881,"The Blind Side",129,2009-11-20,English,6.70,523,"Oversized African American Michael Oher, the teen from across the tracks and a broken home, has nowhere to sleep at age 16. Taken in by an affluent Memphis couple, Leigh Anne and Sean, Michael embarks on a remarkable rise to play for the NFL.",http://ia.media-imdb.com/images/M/MV5BMjEzOTE3ODM3OF5BMl5BanBnXkFtZTcwMzYyODI4Mg@@._V1_SX300.jpg,tt0878804
23823,"Wrong Turn 3: Left for Dead",91,2009-01-01,English,4.60,22,"A group of people find themselves trapped in the backwoods of West Virginia, fighting for their lives against a group of vicious and horribly disfigured inbred cannibals.",http://ia.media-imdb.com/images/M/MV5BMTM0NzkwNTM0MF5BMl5BanBnXkFtZTcwMzY0NjI4Mg@@._V1_SX300.jpg,tt1261978
24021,"The Twilight Saga: Eclipse",124,2010-06-23,English,5.60,415,"Bella once again finds herself surrounded by danger as Seattle is ravaged by a string of mysterious killings and a malicious vampire continues her quest for revenge. In the midst of it all, she is forced to choose between her love for Edward and her friendship with Jacob, knowing that her decision has the potential to ignite the ageless struggle between vampire and werewolf. With her graduation quickly approaching, Bella is confronted with the most important decision of her life.",http://ia.media-imdb.com/images/M/MV5BNDMwNjAzNzYwOF5BMl5BanBnXkFtZTcwMDY5NzcyMw@@._V1_SX300.jpg,tt1325004
24253,"The Girl Who Played with Fire",129,2009-09-18,Swedish,6.80,141,"Mikael Blomkvist, publisher of Millennium magazine, has made his living exposing the crooked and corrupt practices of establishment Swedish figures. So when a young journalist approaches him with a meticulously researched thesis about sex trafficking in Sweden and those in high office who abuse underage girls, Blomkvist immediately throws himself into the investigation.",http://ia.media-imdb.com/images/M/MV5BMjI0MjIxMDIwNF5BMl5BanBnXkFtZTcwODk5MDc1Mw@@._V1_SX300.jpg,tt1216487
24428,"The Avengers",143,2012-05-04,English,7.00,5781,"When an unexpected enemy emerges and threatens global safety and security, Nick Fury, director of the international peacekeeping agency known as S.H.I.E.L.D., finds himself in need of a team to pull the world back from the brink of disaster. Spanning the globe, a daring recruitment effort begins!",http://ia.media-imdb.com/images/M/MV5BMTk2NTI1MTU4N15BMl5BanBnXkFtZTcwODg0OTY0Nw@@._V1_SX300.jpg,tt0848228
25475,"Tinker Bell and the Lost Treasure",81,2009-09-03,English,6.50,24,"A blue harvest moon will rise, allowing the fairies to use a precious moonstone to restore the Pixie Dust Tree, the source of all their magic. But when Tinker Bell accidentally puts all of Pixie Hollow in jeopardy, she must venture out across the sea on a secret quest to set things right.",http://ia.media-imdb.com/images/M/MV5BMTc3OTc4ODc4OV5BMl5BanBnXkFtZTcwOTEzOTIxMw@@._V1_SX300.jpg,tt1216516
26123,"American Pie Presents: The Book of Love",93,2009-12-04,English,5.60,45,"Ten years after the first American Pie movie, three new hapless virgins discover the Bible hidden in the school library at East Great Falls High. Unfortunately for them, the book is ruined, and with incomplete advice, the Bible leads them on a hilarious journey to lose their virginity.",http://ia.media-imdb.com/images/M/MV5BMTUzODM2Nzk2NV5BMl5BanBnXkFtZTcwNzg0Mjc5Mg@@._V1_SX300.jpg,tt1407050
26367,"I Can Do Bad All By Myself",113,2009-09-11,English,6.00,22,"When Madea catches sixteen-year-old Jennifer and her two younger brothers looting her home, she decides to take matters into her own hands and delivers the young delinquents to the only relative they have: their aunt April. A heavy-drinking nightclub singer who lives off of Raymond, her married boyfriend, April wants nothing to do with the kids.",http://ia.media-imdb.com/images/M/MV5BMjEzODgyNzQ1Ml5BMl5BanBnXkFtZTcwMzc0OTY3Mg@@._V1_SX300.jpg,tt1385912
26963,"The Secret of Kells",75,2009-12-04,English,7.20,30,"Adventure awaits 12 year old Brendan who must fight Vikings and a serpent god to find a crystal and complete the legendary Book of Kells. In order to finish Brother Aiden's book, Brendan must overcome his deepest fears on a secret quest that will take him beyond the abbey walls and into the enchanted forest where dangerous mythical creatures hide. Will Brendan succeed in his quest?",http://ia.media-imdb.com/images/M/MV5BMjEzMjEzNTIzOF5BMl5BanBnXkFtZTcwMTg2MjAyMw@@._V1_SX300.jpg,tt0485601
27205,Inception,148,2010-07-16,English,7.40,5550,"Cobb, a skilled thief who commits corporate espionage by infiltrating the subconscious of his targets is offered a chance to regain his old life as payment for a task considered to be impossible: ""inception"", the implantation of another person's idea into a target's subconscious.",http://ia.media-imdb.com/images/M/MV5BMjAxMzY3NjcxNF5BMl5BanBnXkFtZTcwNTI5OTM0Mw@@._V1_SX300.jpg,tt1375666
27578,"The Expendables",103,2010-08-03,English,5.80,1159,"Barney Ross leads a band of highly skilled mercenaries including knife enthusiast Lee Christmas, a martial arts expert, heavy weapons specialist, demolitionist, and a loose-cannon sniper. When the group is commissioned by the mysterious Mr. Church to assassinate the dictator of a small South American island, Barney and Lee visit the remote locale to scout out their opposition and discover the true nature of the conflict engulfing the city.",http://ia.media-imdb.com/images/M/MV5BNTUwODQyNjM0NF5BMl5BanBnXkFtZTcwNDMwMTU1Mw@@._V1_SX300.jpg,tt1320253
32261,Scandal,115,1989-03-03,English,6.10,8,"An English bon-vivant osteopath is enchanted with a young exotic dancer and invites her to live with him. He serves as friend and mentor, and through his contacts and parties she and her friend meet and date members of the Conservative Party. Eventually a scandal occurs when her affair with the Minister of War goes public, threatening their lifestyles and their freedom.",http://ia.media-imdb.com/images/M/MV5BMTMxMTE4MTM0Nl5BMl5BanBnXkFtZTcwNjUzNzAyMQ@@._V1_SX300.jpg,tt0098260
34584,"The NeverEnding Story",102,1984-04-05,English,6.60,159,"While hiding from bullies in his school's attic, a young boy discovers the extraordinary land of Fantasia, through a magical book called The Neverending Story. The book tells the tale of Atreyu, a young warrior who, with the help of a luck dragon named Falkor, must save Fantasia from the destruction of The Nothing.",http://ia.media-imdb.com/images/M/MV5BMTI3MDA3NTQ0MF5BMl5BanBnXkFtZTcwNDEwMDMyMQ@@._V1_SX300.jpg,tt0088323
34673,"Language of Love",95,2004-01-01,Swedish,0.00,0,"Kärlekens språk is a 2004 Swedish sex educational film directed by Anders Lennberg. ""Language of Love"" is ​​a show for night owls, which gives details of sex, problems with impotence, venereal diseases, etc..., with detailed demonstrations.  The title is a reference to the 1969 sex educational film ""Ur kärlekens språk"".",N/A,tt0330541
35791,"Resident Evil: Afterlife",97,2010-09-10,English,5.80,494,"In a world ravaged by a virus infection, turning its victims into the Undead, Alice continues on her journey to find survivors and lead them to safety. Her deadly battle with the Umbrella Corporation reaches new heights, but Alice gets some unexpected help from an old friend. A new lead that promises a safe haven from the Undead takes them to Los Angeles, but when they arrive the city is overrun by thousands of Undead - and Alice and her comrades are about to step into a deadly trap.",http://ia.media-imdb.com/images/M/MV5BMTkxNzM3OTg5OF5BMl5BanBnXkFtZTcwMDA5MDA2Mw@@._V1_SX300.jpg,tt1220634
36557,"Casino Royale",144,2006-11-15,English,6.80,1491,"James Bond goes on his first ever mission as a 00. Le Chiffre is a banker to the world's terrorists. He is participating in a poker game at Montenegro, where he must win back his money, in order to stay safe among the terrorist market. The boss of MI6, known simply as M sends Bond, along with Vesper Lynd to attend this game and prevent Le Chiffre from winning. Bond, using help from Felix Leiter, Mathis and having Vesper pose as his wife, enters the most important poker game in his already dangerous career. But if Bond defeats Le Chiffre, will he and Vesper Lynd remain safe?",http://ia.media-imdb.com/images/M/MV5BMTM5MjI4NDExNF5BMl5BanBnXkFtZTcwMDM1MjMzMQ@@._V1_SX300.jpg,tt0381061
36657,X-Men,104,2000-07-14,English,6.40,1603,"Two mutants, Rogue and Wolverine, come to a private academy for their kind whose resident superhero team, the X-Men, must oppose a terrorist organization with similar powers.",http://ia.media-imdb.com/images/M/MV5BMTYxMTEzNTgzM15BMl5BanBnXkFtZTcwMjg1MzAwMQ@@._V1_SX300.jpg,tt0120903
36658,"X2: X-Men United",133,2003-04-27,English,6.30,969,"Professor Charles Xavier and his team of genetically gifted superheroes face a rising tide of anti-mutant sentiment led by Col. William Stryker in this sequel to the Marvel Comics-based blockbuster X-Men. Storm, Wolverine and Jean Grey must join their usual nemeses Magneto and Mystique to unhinge Stryker's scheme to exterminate all mutants.",http://ia.media-imdb.com/images/M/MV5BNDk0NjYxMzIzOF5BMl5BanBnXkFtZTYwMTc1MjU3._V1_SX300.jpg,tt0290334
36668,"X-Men: The Last Stand",104,2006-05-26,English,6.10,1316,"When a cure is found to treat mutations, lines are drawn amongst the X-Men, led by Professor Charles Xavier, and the Brotherhood, a band of powerful mutants organized under Xavier's former ally, Magneto.",http://ia.media-imdb.com/images/M/MV5BMjI1NTg2ODA2Nl5BMl5BanBnXkFtZTcwMDc2MjEzMw@@._V1_SX300.jpg,tt0376994
36669,"Die Another Day",133,2002-11-17,English,5.60,257,"The ever-daring James Bond taking on a North Korean leader who undergoes DNA replacement procedures that allow him to assume different identities. American agent Jinx Johnson assists Bond in thwarting the villain's plans to exploit a satellite that is powered by solar energy.",http://ia.media-imdb.com/images/M/MV5BMTM2NzY2NjMwMF5BMl5BanBnXkFtZTYwOTUyMDg5._V1_SX300.jpg,tt0246460
37165,"The Truman Show",103,1998-06-04,English,6.90,610,"Truman Burbank is the star of ""The Truman Show"", a 24-hour-a-day ""reality"" TV show that broadcasts every aspect of his life -- live and in color -- without his knowledge. His entire life has been an unending soap opera for consumption by the rest of the world. And everyone he knows--including his wife and his best friend -- is really an actor, paid to be part of his life.",http://ia.media-imdb.com/images/M/MV5BMTM4NjY2MTEzM15BMl5BanBnXkFtZTcwMTk2Njk3OA@@._V1_SX300.jpg,tt0120382
37233,"The Firm",154,1993-06-30,English,6.70,46,"Mitch McDeere is a young man with a promising future in Law. About to sit his Bar exam, he is approached by 'The Firm' and made an offer he doesn't refuse. Seduced by the money and gifts showered on him, he is totally oblivious to the more sinister side of his company. Then, two Associates are murdered. The FBI contact him, asking him for information and suddenly his life is ruined. He has a choice - work with the FBI, or stay with the Firm. Either way he will lose his life as he knows it. Mitch figures the only way out is to follow his own plan...",http://ia.media-imdb.com/images/M/MV5BMTgxMjM5NDYwM15BMl5BanBnXkFtZTgwODkzMzk5MDE@._V1_SX300.jpg,tt0106918
37632,"The Order",89,2001-12-13,English,6.00,4,"When Rudy, an artifacts smuggler, goes to Jerusalem to rescue his kidnapped archeologist father, he faces deportation by a scheming police chief. Now, to find his dad and recover a sacred scroll, he'll have to outwit officials and a ruthless sect. With the help of a beautiful Israeli cop, Rudy battles a faction of religious zealots determined to see a holy war at all costs.",http://ia.media-imdb.com/images/M/MV5BMTc2NjM2MjY0MV5BMl5BanBnXkFtZTcwMTk3MzAyMQ@@._V1_SX300.jpg,tt0193364
37724,Skyfall,143,2012-11-10,English,6.50,3781,"When Bond's latest assignment goes gravely wrong and agents around the world are exposed, MI6 is attacked forcing M to relocate the agency. These events cause her authority and position to be challenged by Gareth Mallory (Ralph Fiennes), the new Chairman of the Intelligence and Security Committee. With MI6 now compromised from both inside and out, M is left with one ally she can trust: Bond. 007 takes to the shadows - aided only by field agent, Eve (Naomie Harris) - following a trail to the mysterious Silva (Javier Bardem), whose lethal and hidden motives have yet to reveal themselves.",http://ia.media-imdb.com/images/M/MV5BMjAyODkzNDgzMF5BMl5BanBnXkFtZTcwMDMxMDI4Nw@@._V1_SX300.jpg,tt1074638
38055,Megamind,95,2010-11-04,English,6.30,446,"Bumbling supervillain Megamind finally defeats his nemesis, the superhero Metro Man. But without a hero, he loses all purpose and must find new meaning to his life.",http://ia.media-imdb.com/images/M/MV5BMTAzMzI0NTMzNDBeQTJeQWpwZ15BbWU3MDM3NTAyOTM@._V1_SX300.jpg,tt1001526
38356,"Transformers: Dark of the Moon",154,2011-06-28,English,6.20,1446,"Sam Witwicky takes his first tenuous steps into adulthood while remaining a reluctant human ally of Autobot-leader Optimus Prime. The film centers around the space race between the USSR and the USA, suggesting there was a hidden Transformers role in it all that remains one of the planet's most dangerous secrets.",http://ia.media-imdb.com/images/M/MV5BMTkwOTY0MTc1NV5BMl5BanBnXkFtZTcwMDQwNjA2NQ@@._V1_SX300.jpg,tt1399103
38365,"Grown Ups",102,2010-06-24,English,6.00,520,"After their high school basketball coach passes away, five good friends and former teammates reunite for a Fourth of July holiday weekend.",http://ia.media-imdb.com/images/M/MV5BMjA0ODYwNzU5Nl5BMl5BanBnXkFtZTcwNTI1MTgxMw@@._V1_SX300.jpg,tt1375670
39514,RED,111,2010-10-14,English,6.30,1198,"When his peaceful life is threatened by a high-tech assassin, former black-ops agent Frank Moses reassembles his old team in a last ditch effort to survive and uncover his assailants.",http://ia.media-imdb.com/images/M/MV5BMzg2Mjg1OTk0NF5BMl5BanBnXkFtZTcwMjQ4MTA3Mw@@._V1_SX300.jpg,tt1245526
39928,"H6: Diario de un asesino",92,2005-01-01,Spanish,5.00,1,"H6 tells the story of Antonio Frau, a serial killer set free after serving 25 years in jail for the violent murder of his girlfriend. After inheriting and old motel from a relative he never knew, he sees this as a signal and takes to his holy task of relieving the grief of those who have lost the will to live. He takes his victims to room Number 6 in the motel where he 'purifies' them, while, at the same time, continues his everyday life next to his wife. A mistake leads to his arrest, and his plan to become rich and famous takes relevance.",http://ia.media-imdb.com/images/M/MV5BMTIyMjIzMjA0N15BMl5BanBnXkFtZTcwNzQwNzMzMQ@@._V1_SX300.jpg,tt0455115
41154,"Men in Black 3",106,2012-05-25,English,6.00,1785,"Agents J (Will Smith) and K (Tommy Lee Jones) are back...in time. J has seen some inexplicable things in his 15 years with the Men in Black, but nothing, not even aliens, perplexes him as much as his wry, reticent partner. But when K's life and the fate of the planet are put at stake, Agent J will have to travel back in time to put things right. J discovers that there are secrets to the universe that K never told him - secrets that will reveal themselves as he teams up with the young Agent K (Josh Brolin) to save his partner, the agency, and the future of humankind.",http://ia.media-imdb.com/images/M/MV5BMTU2NTYxODcwMF5BMl5BanBnXkFtZTcwNDk1NDY0Nw@@._V1_SX300.jpg,tt1409024
41233,"Step Up 3D",107,2010-08-26,English,6.50,71,"A tight-knit group of New York City street dancers, including Luke and Natalie, team up with NYU freshman Moose, and find themselves pitted against the world's best hip hop dancers in a high-stakes showdown that will change their lives forever.",http://ia.media-imdb.com/images/M/MV5BMTcxNDU2NTE4Nl5BMl5BanBnXkFtZTcwNzQ1MTEzMw@@._V1_SX300.jpg,tt1193631
41283,Faster,98,2010-11-23,English,6.20,131,"Driver (Dwayne Johnson) has spent the last 10 years in prison planning revenge for the murder of his brother. Now that Driver is free to carry out his deadly plan only two men stand in his way- Billy Bob Thornton plays a veteran cop and Oliver Jackson-Cohen, a crazy hitman. With those two close on his trail, Driver races to carry out his mission as the mystery surrounding his brothers murder deepens.",http://ia.media-imdb.com/images/M/MV5BMTMyOTQ5MTAxOF5BMl5BanBnXkFtZTcwOTYzMDg5Mw@@._V1_SX300.jpg,tt1433108
41602,"The Necessary Death of Charlie Countryman",108,2013-11-15,English,7.60,38,"While traveling abroad, a guy falls for a Romanian beauty whose unreachable heart has its origins in her violent, charismatic ex.",http://ia.media-imdb.com/images/M/MV5BMjA3MTcyNjk3NF5BMl5BanBnXkFtZTgwNjkzNzUzMDE@._V1_SX300.jpg,tt1196948
42189,"Kevin Hart: Seriously Funny",72,2010-07-20,English,8.30,9,"Fresh off the heels of appearing in movies like Superhero Movie and The 40 Year-Old Virgin, fast-talking comedian Kevin Hart stars in his second live stand-up performance in Cleveland, Ohio, where he makes fun of everything and everybody - especially himself.",http://ia.media-imdb.com/images/M/MV5BMTcxNTI2OTA4Ml5BMl5BanBnXkFtZTcwMDA1MjE5NA@@._V1_SX300.jpg,tt1714196
44683,"Tinker Bell and the Great Fairy Rescue",76,2010-08-31,English,6.00,24,"During a summer stay on the mainland, TinkerBell is accidentally discovered while investigating a little girl's fairy house. As the other fairies, led by the brash Vidia, launch a daring rescue in the middle of a fierce storm, Tink develops a special bond with the lonely, little girl. Determined to mend the girl's relationship with her distant father, Tink turns away her rescuers in order to help her new human friend risking her own safety and the future of fairykind.",http://ia.media-imdb.com/images/M/MV5BMTcxNDI2MzM4M15BMl5BanBnXkFtZTcwNzA4OTk2Mw@@._V1_SX300.jpg,tt1216515
44833,Battleship,131,2012-05-18,English,5.50,798,"When mankind beams a radio signal into space, a reply comes from ""Planet G"", in the form of several alien crafts that splash down in the waters off Hawaii. Lieutenant Alex Hopper (Taylor Kitsch) is a navel weapons officer assigned to the ship USS John Paul Jones, part of an international naval coalition which becomes the world's last hope for survival as they engage the hostile alien force of unimaginable strength. While takng on the invaders, Hopper must also try to live up to the potential his brother Stone (Alexander Skarsgård) and his fiancée's father, Admiral Shane (Liam Neeson), expect of him.",http://ia.media-imdb.com/images/M/MV5BMjI5NTM5MDA2N15BMl5BanBnXkFtZTcwNjkwMzQxNw@@._V1_SX300.jpg,tt1440129
44896,Rango,107,2011-03-03,English,6.30,549,"When Rango, a lost family pet, accidentally winds up in the gritty, gun-slinging town of Dirt, the less-than-courageous lizard suddenly finds he stands out. Welcomed as the last hope the town has been waiting for, new Sheriff Rango is forced to play his new role to the hilt.",http://ia.media-imdb.com/images/M/MV5BMjE5ODg1NTk3OF5BMl5BanBnXkFtZTcwNzA5NTMyNA@@._V1_SX300.jpg,tt1192628
46195,Rio,96,2011-04-15,English,6.30,742,"From the makers of the hit ""Ice Age"" series comes ""Rio,"" a comedy adventure about taking a walk on the wild side. Blu is a domesticated Macaw who never learned to fly, living a comfortable life with his owner and best friend Linda in the small town of Moose Lake, Minnesota. Blu and Linda think he's the last of his kind, but when they learn about another Macaw who lives in Rio de Janeiro, they head to the faraway and exotic land to find Jewel, Blu's female counterpart. Not long after they arrive, Blu and Jewel are kidnapped by a group of bungling animal smugglers. With the help of street smart Jewel, and a group of wise-cracking and smooth-talking city birds, Blu escapes. Now, with his new friends by his side, Blu will have to find the courage to learn to fly, thwart the kidnappers who are hot on their trail, and return to Linda, the best friend a bird ever had.",http://ia.media-imdb.com/images/M/MV5BMTU2MDY3MzAzMl5BMl5BanBnXkFtZTcwMTg0NjM5NA@@._V1_SX300.jpg,tt1436562
47964,"A Good Day to Die Hard",97,2013-02-14,English,5.20,2293,"Iconoclastic, take-no-prisoners cop John McClane, finds himself for the first time on foreign soil after traveling to Moscow to help his wayward son Jack - unaware that Jack is really a highly-trained CIA operative out to stop a nuclear weapons heist. With the Russian underworld in pursuit, and battling a countdown to war, the two McClanes discover that their opposing methods make them unstoppable heroes.",http://ia.media-imdb.com/images/M/MV5BMTcwNzgyNzUzOV5BMl5BanBnXkFtZTcwMzAwOTA5OA@@._V1_SX300.jpg,tt1606378
49013,"Cars 2",106,2011-06-16,English,5.90,628,"Star race car Lightning McQueen and his pal Mater head overseas to compete in the World Grand Prix race. But the road to the championship becomes rocky as Mater gets caught up in an intriguing adventure of his own: international espionage.",http://ia.media-imdb.com/images/M/MV5BMTUzNTc3MTU3M15BMl5BanBnXkFtZTcwMzIxNTc3NA@@._V1_SX300.jpg,tt1216475
49026,"The Dark Knight Rises",165,2012-07-20,English,7.20,4040,"Following the death of District Attorney Harvey Dent, Batman assumes responsibility for Dent's crimes to protect the late attorney's reputation and is subsequently hunted by the Gotham City Police Department. Eight years later, Batman encounters the mysterious Selina Kyle and the villainous Bane, a new terrorist leader who overwhelms Gotham's finest. The Dark Knight resurfaces to protect a city that has branded him an enemy.",http://ia.media-imdb.com/images/M/MV5BMTk4ODQzNDY3Ml5BMl5BanBnXkFtZTcwODA0NTM4Nw@@._V1_SX300.jpg,tt1345836
49040,"The Bourne Legacy",120,2012-08-10,English,5.80,1312,"The fourth installment of the highly successful Bourne series sidelines main character Jason Bourne in order to focus on a fellow estranged assassin Aaron Cross (Jeremy Renner). The story centers on new CIA operative, Aaron Cross as he experiences life-or-death stakes that have been triggered by the previous actions of Jason Bourne. Edward Norton and Rachel Weisz co-star, with Joan Allen and Albert Finney reprising their roles from the previous films.",http://ia.media-imdb.com/images/M/MV5BMTc4Njk3MDM1Nl5BMl5BanBnXkFtZTcwODgyOTMxOA@@._V1_SX300.jpg,tt1194173
49047,Gravity,91,2013-10-04,English,7.90,766,"Dr. Ryan Stone (Sandra Bullock), a brilliant medical engineer on her first Shuttle mission, with veteran astronaut Matt Kowalsky (George Clooney) in command of his last flight before retiring. But on a seemingly routine spacewalk, disaster strikes. The Shuttle is destroyed, leaving Stone and Kowalsky completely alone-tethered to nothing but each other and spiraling out into the blackness of space. The deafening silence tells them they have lost any link to Earth and any chance for rescue. As fear turns to panic, every gulp of air eats away at what little oxygen is left. But the only way home may be to go further out into the terrifying expance of space…",http://ia.media-imdb.com/images/M/MV5BNjE5MzYwMzYxMF5BMl5BanBnXkFtZTcwOTk4MTk0OQ@@._V1_SX300.jpg,tt1454468
49051,"The Hobbit: An Unexpected Journey",169,2012-12-14,English,6.50,4046,"Bilbo Baggins, a hobbit enjoying his quiet life, is swept into an epic quest by Gandalf the Grey and thirteen dwarves who seek to reclaim their mountain home from Smaug, the dragon.",http://ia.media-imdb.com/images/M/MV5BMTcwNTE4MTUxMl5BMl5BanBnXkFtZTcwMDIyODM4OA@@._V1_SX300.jpg,tt0903624
49519,"The Croods",98,2013-03-21,English,6.80,761,"The Croods is a prehistoric comedy adventure that follows the world's first family as they embark on a journey of a lifetime when the cave that has always shielded them from danger is destroyed. Traveling across a spectacular landscape, the Croods discover an incredible new world filled with fantastic creatures -- and their outlook is changed forever.",http://ia.media-imdb.com/images/M/MV5BMTcyOTc2OTA1Ml5BMl5BanBnXkFtZTcwOTI1MjkzOQ@@._V1_SX300.jpg,tt0481499
49521,"Man of Steel",143,2013-06-14,English,6.50,2392,"A young boy learns that he has extraordinary powers and is not of this earth. As a young man, he journeys to discover where he came from and what he was sent here to do. But the hero in him must emerge if he is to save the world from annihilation and become the symbol of hope for all mankind.",http://ia.media-imdb.com/images/M/MV5BMjI5OTYzNjI0Ml5BMl5BanBnXkFtZTcwMzM1NDA1OQ@@._V1_SX300.jpg,tt0770828
49524,R.I.P.D.,96,2013-07-19,English,5.60,241,"A recently slain cop joins a team of undead police officers working for the Rest in Peace Department and tries to find the man who murdered him. Based on the comic by Peter M. Lenkov.",http://ia.media-imdb.com/images/M/MV5BMTM5OTYxNzE5N15BMl5BanBnXkFtZTcwMDU1MTQ4OQ@@._V1_SX300.jpg,tt0790736
49529,"John Carter",132,2012-03-07,English,5.90,564,"Civil War vet John Carter is transplanted to Mars, where he discovers a lush, wildly diverse planet whose main inhabitants are 12-foot tall green barbarians. Finding himself a prisoner of these creatures, he escapes, only to encounter Dejah Thoris, Princess of Helium, who is in desperate need of a savior.",http://ia.media-imdb.com/images/M/MV5BNjkyOTI5MDA0Ml5BMl5BanBnXkFtZTcwOTU3NzExNw@@._V1_SX300.jpg,tt0401729
49538,"X-Men: First Class",132,2011-05-24,English,6.70,2103,"Before Charles Xavier and Erik Lensherr took the names Professor X and Magneto, they were two young men discovering their powers for the first time. Before they were arch-enemies, they were closest of friends, working together with other mutants (some familiar, some new), to stop the greatest threat the world has ever known.",http://ia.media-imdb.com/images/M/MV5BMTg5OTMxNzk4Nl5BMl5BanBnXkFtZTcwOTk1MjAwNQ@@._V1_SX300.jpg,tt1270798
