MovieID,MovieName,RunTime,ReleaseDate,Language,Rating,Vote_count,Plot,Poster,ImdbID
97020,RoboCop,102,2014-02-07,English,6.80,77,"In RoboCop, the year is 2028 and multinational conglomerate OmniCorp is at the center of robot technology.  Overseas, their drones have been used by the military for years, but have been forbidden for law enforcement in America.  Now OmniCorp wants to bring their controversial technology to the home front, and they see a golden opportunity to do it.  When Alex Murphy (Joel Kinnaman) – a loving husband, father and good cop doing his best to stem the tide of crime and corruption in Detroit – is critically injured, OmniCorp sees their chance to build a part-man, part-robot police officer.  OmniCorp envisions a RoboCop in every city and even more billions for their shareholders, but they never counted on one thing: there is still a man inside the machine.",http://ia.media-imdb.com/images/M/MV5BMjAyOTUzMTcxN15BMl5BanBnXkFtZTgwMjkyOTc1MDE@._V1_SX300.jpg,tt1234721
97370,"Under the Skin",108,2014-04-04,English,8.00,1,"An alien in human form is on a journey through Scotland.",http://ia.media-imdb.com/images/M/MV5BMTU1MDEwMDg4Nl5BMl5BanBnXkFtZTgwOTk3NTcxMTE@._V1_SX300.jpg,tt1441395
97630,"Zero Dark Thirty",157,2012-12-19,English,6.00,591,"A chronicle of the decade-long hunt for al-Qaeda terrorist leader Osama bin Laden after the September 2001 attacks, and his death at the hands of the Navy S.E.A.L. Team 6 in May, 2011.",http://ia.media-imdb.com/images/M/MV5BMTQ4OTUyNzcwN15BMl5BanBnXkFtZTcwMTQ1NDE3OA@@._V1_SX300.jpg,tt1790885
100241,"I, Frankenstein",92,2014-01-24,English,6.20,28,"200 years after his shocking creation, Dr. Frankenstein's creature, Adam, still walks the earth. But when he finds himself in the middle of a war over the fate of humanity, Adam discovers he holds the key that could destroy humankind.",http://ia.media-imdb.com/images/M/MV5BMjM3Mzk2MDU3N15BMl5BanBnXkFtZTgwMzg1NTI4MDE@._V1_SX300.jpg,tt1418377
100402,"Captain America: The Winter Soldier",128,2014-04-04,English,6.60,88,"After the cataclysmic events in New York with The Avengers, Steve Rogers, aka Captain America is living quietly in Washington, D.C. and trying to adjust to the modern world. But when a S.H.I.E.L.D. colleague comes under attack, Steve becomes embroiled in a web of intrigue that threatens to put the world at risk. Joining forces with the Black Widow, Captain America struggles to expose the ever-widening conspiracy while fighting off professional assassins sent to silence him at every turn. When the full scope of the villainous plot is revealed, Captain America and the Black Widow enlist the help of a new ally, the Falcon. However, they soon find themselves up against an unexpected and formidable enemy—the Winter Soldier.",http://ia.media-imdb.com/images/M/MV5BMzA2NDkwODAwM15BMl5BanBnXkFtZTgwODk5MTgzMTE@._V1_SX300.jpg,tt1843866
100542,Vikingdom,114,2013-09-11,English,6.20,3,"A warrior fleeing the violence of his past must take up the sword and risk everything to face a god of incalculable power.",http://ia.media-imdb.com/images/M/MV5BMTYxODY5MTk5OV5BMl5BanBnXkFtZTcwMTkyOTAwNw@@._V1_SX300.jpg,tt1785669
101286,"Surf Party",0,1964-01-30,English,0.00,0,"Arizona youth enjoy sun, surf and music in Malibu, Calif.",http://ia.media-imdb.com/images/M/MV5BNDkyNzMwNTUwNF5BMl5BanBnXkFtZTYwMTAyOTc5._V1_SX300.jpg,tt0058626
101299,"The Hunger Games: Catching Fire",146,2013-11-22,English,7.70,536,"Katniss Everdeen has returned home safe after winning the 74th Annual Hunger Games along with fellow tribute Peeta Mellark. Winning means that they must turn around and leave their family and close friends, embarking on a ""Victor's Tour"" of the districts. Along the way Katniss senses that a rebellion is simmering, but the Capitol is still very much in control as President Snow prepares the 75th Annual Hunger Games (The Quarter Quell) - a competition that could change Panem forever.",http://ia.media-imdb.com/images/M/MV5BMTAyMjQ3OTAxMzNeQTJeQWpwZ15BbWU4MDU0NzA1MzAx._V1_SX300.jpg,tt1951264
106646,"The Wolf of Wall Street",180,2013-12-25,English,7.80,354,"A New York stockbroker refuses to cooperate in a large securities fraud case involving corruption on Wall Street, corporate banking world and mob infiltration. Based on Jordan Belfort's autobiography.",http://ia.media-imdb.com/images/M/MV5BMjIxMjgxNTk0MF5BMl5BanBnXkFtZTgwNjIyOTg2MDE@._V1_SX300.jpg,tt0993846
106747,"Machete Kills",107,2013-10-11,English,5.60,53,"Ex-Federale agent MACHETE is recruited by the President of the United States for a mission which would be impossible for any mortal man – he must take down a madman revolutionary and an eccentric billionaire arms dealer who has hatched a plan to spread war and anarchy across the planet.",http://ia.media-imdb.com/images/M/MV5BMjA2MzUxMTM3M15BMl5BanBnXkFtZTgwMzA2NzkxMDE@._V1_SX300.jpg,tt2002718
107846,"Escape Plan",115,2013-10-18,English,6.90,199,"Ray Breslin is the world's foremost authority on structural security. After analyzing every high security prison and learning a vast array of survival skills so he can design escape-proof prisons, his skills are put to the test. He's framed and incarcerated in a master prison he designed himself. He needs to escape and find the person who put him behind bars.",http://ia.media-imdb.com/images/M/MV5BMTk3OTcxMTEyNl5BMl5BanBnXkFtZTcwMDQ4MjQ2OQ@@._V1_SX300.jpg,tt1211956
107985,"The World's End",109,2013-07-19,English,7.00,221,"Five friends who reunite in an attempt to top their epic pub crawl from 20 years earlier unwittingly become humankind's only hope for survival.",http://ia.media-imdb.com/images/M/MV5BNzA1MTk1MzY0OV5BMl5BanBnXkFtZTgwNjkzNTUwMDE@._V1_SX300.jpg,tt1213663
109091,"The Counselor",117,2013-10-25,English,5.60,79,"A rich and successful lawyer named Counselor is about to get married to his fiancée but soon meets up with the middle-man known as Westray who tells him his drug trafficking plan has taken a horrible twist and now he must protect himself and his soon bride-to-be lover as the truth of the drug business uncovers and targets become chosen.",http://ia.media-imdb.com/images/M/MV5BMTc3ODk0MTY0N15BMl5BanBnXkFtZTgwOTU2MTEzMDE@._V1_SX300.jpg,tt2193215
109417,"Battle of the Year",110,2013-09-21,English,5.90,11,"A down-on-his-luck coach is hired to prepare a team of the best American dancers for an international tournament that attracts all the best crews from around the world, but the Americans haven't won in fifteen years.",http://ia.media-imdb.com/images/M/MV5BOTY2OTcyNzM3NF5BMl5BanBnXkFtZTgwNzgxMjkxMDE@._V1_SX300.jpg,tt1532958
109418,"Grown Ups 2",100,2013-07-12,English,6.20,314,"The all-star comedy cast from Grown Ups returns (with some exciting new additions) for more summertime laughs. Lenny (Adam Sandler) has relocated his family back to the small town where he and his friends grew up. This time around, the grown ups are the ones learning lessons from their kids on a day notoriously full of surprises: the last day of school.",http://ia.media-imdb.com/images/M/MV5BMTgwNTI2MDI0OF5BMl5BanBnXkFtZTcwMTk5MDg0OQ@@._V1_SX300.jpg,tt2191701
109424,"Captain Phillips",134,2013-10-11,English,7.90,342,"The true story of Captain Richard Phillips and the 2009 hijacking by Somali pirates of the US-flagged MV Maersk Alabama, the first American cargo ship to be hijacked in two hundred years.",http://ia.media-imdb.com/images/M/MV5BMTQzNzExMDg3Ml5BMl5BanBnXkFtZTgwODU1NzEzMDE@._V1_SX300.jpg,tt1535109
109439,"The Hangover Part III",100,2013-05-23,English,5.90,904,"This time, there's no wedding. No bachelor party. What could go wrong, right? But when the Wolfpack hits the road, all bets are off.",http://ia.media-imdb.com/images/M/MV5BMTA0NjE1MzMzODheQTJeQWpwZ15BbWU3MDY4MTQ3Mzk@._V1_SX300.jpg,tt1951261
109443,"Anchorman 2: The Legend Continues",119,2013-12-18,English,6.20,52,"With the 70s behind him, San Diego's top rated newsman, Ron Burgundy, returns to take New York's first 24-hour news channel by storm.",http://ia.media-imdb.com/images/M/MV5BMjE5ODk0NjQzNV5BMl5BanBnXkFtZTgwODk4MDA1MDE@._V1_SX300.jpg,tt1229340
109445,Frozen,102,2013-11-19,English,7.80,377,"Young princess Anna of Arendelle dreams about finding true love at her sister Elsa’s coronation. Fate takes her on a dangerous journey in an attempt to end the eternal winter that has fallen over the kingdom. She's accompanied by ice delivery man Kristoff, his reindeer Sven, and snowman Olaf. On an adventure where she will find out what friendship, courage, family, and true love really means.",http://ia.media-imdb.com/images/M/MV5BMTQ1MjQwMTE5OF5BMl5BanBnXkFtZTgwNjk3MTcyMDE@._V1_SX300.jpg,tt2294629
109451,"Cloudy with a Chance of Meatballs 2",95,2013-09-27,English,6.80,106,"After the disastrous food storm in the first film, Flint and his friends are forced to leave the town. Flint accepts the invitation from his idol Chester V to join The Live Corp Company, which has been tasked to clean the island, and where the best inventors in the world create technologies for the betterment of mankind. When Flint discovers that his machine still operates and now creates mutant food beasts like living pickles, hungry tacodiles, shrimpanzees and apple pie-thons, he and his friends must return to save the world.",http://ia.media-imdb.com/images/M/MV5BMTYzNDM0MDI1NF5BMl5BanBnXkFtZTcwNzQ5NzYxOQ@@._V1_SX300.jpg,tt1985966
110122,"The Last Push",90,2012-06-01,English,5.50,2,"When a tragic accident cuts short the first manned mission to explore life on the moons of Jupiter, Michael Forrest must make the 3 year journey home to Earth in pure solitude",http://ia.media-imdb.com/images/M/MV5BMjA0NDI3NzgxNV5BMl5BanBnXkFtZTcwMzY3MTM5OQ@@._V1_SX300.jpg,tt1541123
110414,Nymphomaniac,240,2014-03-06,English,7.00,13,"A man named Seligman finds a fainted wounded woman in an alley and he brings her home. She tells him that her name is Joe and that she is nymphomaniac. Joe tells her life and sexual experiences with hundreds of men since she was a young teenager while Seligman tells about his hobbies, such as fly fishing, reading about Fibonacci numbers or listening to organ music.",http://ia.media-imdb.com/images/M/MV5BMjA3Njc5MjI5Ml5BMl5BanBnXkFtZTgwNTY3Mjg3MDE@._V1_SX300.jpg,tt1937390
110415,Snowpiercer,126,2013-08-01,English,7.00,38,"In a future where a failed global-warming experiment kills off most life on the planet, a class system evolves aboard the Snowpiercer, a train that travels around the globe via a perpetual-motion engine.",http://ia.media-imdb.com/images/M/MV5BMTY0OTIyOTExNl5BMl5BanBnXkFtZTgwOTQ4ODc0MDE@._V1_SX300.jpg,tt1706620
111473,"The Invisible Woman",111,2013-12-25,English,5.60,4,"In 1857, at the height of his fame and fortune, novelist and social critic Charles Dickens meets and falls in love with teenage stage actress Nelly Ternan. As she becomes the focus of his heart and mind, as well as his muse, painful secrecy is the price both must pay.",http://ia.media-imdb.com/images/M/MV5BMzQxMTI3MDUzOF5BMl5BanBnXkFtZTgwNzc4MzI1MDE@._V1_SX300.jpg,tt1700845
112205,"The Family",111,2013-09-13,English,6.70,128,"The Manzoni family, a notorious mafia clan, is relocated to Normandy, France under the witness protection program, where fitting in soon becomes challenging as their old habits die hard.",http://ia.media-imdb.com/images/M/MV5BMjE2MzI0MzkyNV5BMl5BanBnXkFtZTcwMjQ2MDM2OQ@@._V1_SX300.jpg,tt2404311
114150,"Pitch Perfect",112,2012-09-28,English,6.60,414,"A comedy set in the middle of a war between rival a cappella groups and centered on a rebellious girl who joins one of the groups as an escape from her unhappy life at school.",http://ia.media-imdb.com/images/M/MV5BMTcyMTMzNzE5N15BMl5BanBnXkFtZTcwNzg5NjM5Nw@@._V1_SX300.jpg,tt1981677
115283,A.C.O.D.,88,2013-10-04,English,5.70,11,"A grown man is still caught in the crossfire of his parents 15 year divorce. He discovers he was unknowingly part of a study on divorced children and is enlisted in a follow-up years later, which wreaks new havoc on his family.",http://ia.media-imdb.com/images/M/MV5BMTQwNTc5MjkyNF5BMl5BanBnXkFtZTgwNzQ5NTYwMDE@._V1_SX300.jpg,tt1311060
115782,Jobs,128,2013-08-16,English,6.10,185,"The story of Steve Jobs' ascension from college dropout into one of the most revered creative entrepreneurs of the 20th century.",http://ia.media-imdb.com/images/M/MV5BMTM5NTQ3MTYxN15BMl5BanBnXkFtZTcwODE2Nzk3OQ@@._V1_SX300.jpg,tt2357129
116711,Epic,102,2013-05-24,English,6.40,360,"A teenager finds herself transported to a deep forest setting where a battle between the forces of good and the forces of evil is taking place. She bands together with a rag-tag group characters in order to save their world -- and ours.",http://ia.media-imdb.com/images/M/MV5BMTgyNDYwNzE5NV5BMl5BanBnXkFtZTcwMzUyODM5OA@@._V1_SX300.jpg,tt0848537
116741,"The Internship",119,2013-06-07,English,6.20,299,"Two recently laid-off men in their 40s try to make it as interns at a successful Internet company where their managers are in their 20s.",http://ia.media-imdb.com/images/M/MV5BMjM1MzczMDgwOV5BMl5BanBnXkFtZTcwMDM4NjM2OQ@@._V1_SX300.jpg,tt2234155
116745,"The Secret Life of Walter Mitty",114,2013-12-25,English,7.20,140,"A timid magazine photo manager who lives life vicariously through daydreams embarks on a true-life adventure when a negative goes missing.",http://ia.media-imdb.com/images/M/MV5BODYwNDYxNDk1Nl5BMl5BanBnXkFtZTgwOTAwMTk2MDE@._V1_SX300.jpg,tt0359950
117251,"White House Down",137,2013-06-28,English,6.40,412,"Capitol Policeman John Cale has just been denied his dream job with the Secret Service of protecting President James Sawyer. Not wanting to let down his little girl with the news, he takes her on a tour of the White House, when the complex is overtaken by a heavily armed paramilitary group. Now, with the nation's government falling into chaos and time running out, it's up to Cale to save the president, his daughter, and the country.",http://ia.media-imdb.com/images/M/MV5BMTAyNzQyNTcwNjVeQTJeQWpwZ15BbWU3MDAwOTQ4Nzk@._V1_SX300.jpg,tt2334879
117263,"Olympus Has Fallen",120,2013-03-22,English,6.10,1527,"When the White House (Secret Service Code: ""Olympus"") is captured by a terrorist mastermind and the President is kidnapped, disgraced former Presidential guard Mike Banning finds himself trapped within the building. As the national security team scrambles to respond, they are forced to rely on Banning's inside knowledge to help retake the White House, save the President and avert an even bigger disaster.",http://ia.media-imdb.com/images/M/MV5BMTkxNjIyNjE5OF5BMl5BanBnXkFtZTcwMTI3NzkxOQ@@._V1_SX300.jpg,tt2302755
119283,Parker,118,2013-01-25,English,5.50,778,"A thief with a unique code of professional ethics is double-crossed by his crew and left for dead. Assuming a new disguise and forming an unlikely alliance with a woman on the inside, he looks to hijack the score of the crew's latest heist.",http://ia.media-imdb.com/images/M/MV5BMTk4MzM2NTQ1Nl5BMl5BanBnXkFtZTcwODIyODY1OA@@._V1_SX300.jpg,tt1904996
119892,"The Monkey King",119,2014-01-25,Mandarin,5.70,7,"Sun Wukong, (The Monkey King) is a monkey born from a heavenly stone who acquires supernatural powers. After rebelling against heaven and being imprisoned under a mountain for 500 years, he later accompanies the monk Xuanzang on a journey to India. Thus, according to legend, Buddhism is brought to ancient China. This much beloved story, is as much a part of Asian culture as The Iliad and The Odyssey or The Wizard of Oz are to the West. This first installment in a trilogy of live action 3-D movies is actually a prequel to The Journey To The West, the much told story of the Monkey King's adventures on the road to India.",http://ia.media-imdb.com/images/M/MV5BMTcxMTI3NzQ0Ml5BMl5BanBnXkFtZTgwOTgxMDM2MDE@._V1_SX300.jpg,tt1717715
121640,Zaytoun,107,2013-09-20,English,4.00,1,"Beirut, 1982: a young Palestinian refugee and an Israeli fighter pilot form a tentative bond in their attempt to make their way across war-torn Lebanon back to their home.",http://ia.media-imdb.com/images/M/MV5BMTQwNjc2OTg0NV5BMl5BanBnXkFtZTgwNzYyMTIwMDE@._V1_SX300.jpg,tt2131698
121734,"Tad, the Lost Explorer",90,2013-06-28,English,5.80,25,"Tad is a celebrity archeologist and adventurer just like his hero Max Mordon... in his dreams! In reality, Tad is a Chicago construction worker. One day, however, he is mistaken for a real Professor and takes his place on a flight to Peru in search of the Lost City of Paititi. Professor Lavrof and his beautiful daughter Sara are waiting for the famous professor to crack the code. Unfortunately for Tad, Sara is engaged to real-life hero Max Mordon, but Max has secretly betrayed the Professor by teaming up with the evil Kopponen and his shady Odysseus corporation. Time for Tad to step up...",http://ia.media-imdb.com/images/M/MV5BMjM4ODM4MzI2OF5BMl5BanBnXkFtZTcwMDgxNjU0OA@@._V1_SX300.jpg,tt1764625
122081,"Spring Breakers",94,2012-09-05,English,4.90,411,"Brit, Candy, Cotty, and Faith have been best friends since grade school. They live together in a boring college dorm and are hungry for adventure. All they have to do is save enough money for spring break to get their shot at having some real fun. A serendipitous encounter with rapper ""Alien"" promises to provide the girls with all the thrill and excitement they could hope for. With the encouragement of their new friend, it soon becomes unclear how far the girls are willing to go to experience a spring break they will never forget.",http://ia.media-imdb.com/images/M/MV5BNDE3MDQzMDA5OF5BMl5BanBnXkFtZTcwMTUxNTgxOQ@@._V1_SX300.jpg,tt2101441
122906,"About Time",123,2013-11-08,English,7.60,155,"The night after another unsatisfactory New Year party, Tim's father (Bill Nighy) tells his son that the men in his family have always had the ability to travel through time. Tim can't change history, but he can change what happens and has happened in his own life---so he decides to make his world a better place...by getting a girlfriend. Sadly, that turns out not to be as easy as you might think.",http://ia.media-imdb.com/images/M/MV5BMTA1ODUzMDA3NzFeQTJeQWpwZ15BbWU3MDgxMTYxNTk@._V1_SX300.jpg,tt2194499
123553,"The Mortal Instruments: City of Bones",130,2013-08-21,English,6.40,143,"Clary Fray tumbles into the supernatural world when she visits a club called Pandemonium, and witnesses a murder. Following this tragic event Clary's mother, Jocelyn, is kidnapped by a man called Valentine. She then calls on those who she saw at the club, and asks them to help her. In the search for the Mortal Cup, Clary makes decisions harder than any she has ever made. She falls in love, struggles with her best friend, and becomes the person her mother feared she would become.",http://ia.media-imdb.com/images/M/MV5BMTc5NzAyOTQyNF5BMl5BanBnXkFtZTcwNzQ1MDc4OQ@@._V1_SX300.jpg,tt1538403
124905,Godzilla,0,2014-05-16,English,7.80,3,"An epic rebirth to Toho's iconic Godzilla, this spectacular adventure pits the world's most famous monster against malevolent creatures who, bolstered by humanity's scientific arrogance, threaten our very existence.",http://ia.media-imdb.com/images/M/MV5BMTQ0ODgzNjg2MV5BMl5BanBnXkFtZTgwNDkxMzc3MDE@._V1_SX300.jpg,tt0831387
125509,"Wrong Turn 5: Bloodlines",91,2012-10-23,English,4.90,27,"A small West Virginia town is hosting the legendary Mountain Man Festival on Halloween, where throngs of costumed party goers gather for a wild night of music and mischief. But an inbred family of hillbilly cannibals kill the fun when they trick and treat themselves to a group of visiting college students.",http://ia.media-imdb.com/images/M/MV5BMTU3ODA2NzE5MV5BMl5BanBnXkFtZTcwODE2ODg3OA@@._V1_SX300.jpg,tt2375779
126250,"Love is All You Need",116,2012-09-04,English,6.50,13,"Romantic comedy from Academy Award winner Susanne Bier (Brothers, In a Better World), about two very different families brought together for a wedding in a beautiful old Italian villa.",http://ia.media-imdb.com/images/M/MV5BNzYxMDQwMzIzMF5BMl5BanBnXkFtZTcwNjcxODIzOQ@@._V1_SX300.jpg,tt1854236
127585,"X-Men: Days of Future Past",0,2014-05-23,English,5.80,39,"The ultimate X-Men ensemble fights a war for the survival of the species across two time periods in X-MEN: DAYS OF FUTURE PAST. The beloved characters from the original “X-Men” film trilogy join forces with their younger selves from “X-Men: First Class,” in an epic battle that must change the past – to save our future.",http://ia.media-imdb.com/images/M/MV5BMTA2MDU0MjUxNDNeQTJeQWpwZ15BbWU4MDEwOTAwNTAx._V1_SX300.jpg,tt1877832
129670,Nebraska,115,2013-11-15,English,7.50,50,"An aging, booze-addled father makes the trip from Montana to Nebraska with his estranged son in order to claim a million dollar Publisher's Clearing House sweepstakes prize.",http://ia.media-imdb.com/images/M/MV5BMTU2Mjk2NDkyMl5BMl5BanBnXkFtZTgwNTk0NzcyMDE@._V1_SX300.jpg,tt1821549
132344,"Before Midnight",108,2013-06-14,English,7.00,85,"We meet Jesse and Celine nine years on in Greece. Almost two decades have passed since their first meeting on that train bound for Vienna.",http://ia.media-imdb.com/images/M/MV5BMjA5NzgxODE2NF5BMl5BanBnXkFtZTcwNTI1NTI0OQ@@._V1_SX300.jpg,tt2209418
132363,"The Butler",132,2013-08-16,English,7.20,115,"A look at the life of Cecil Gaines who served eight presidents as the White House's head butler from 1952 to 1986, and had a unique front-row seat as political and racial history was made.",http://ia.media-imdb.com/images/M/MV5BMjM2NDY3MjkyMF5BMl5BanBnXkFtZTcwMDM5Nzg5OQ@@._V1_SX300.jpg,tt1327773
133805,Carrie,100,2013-10-18,English,6.60,153,"A sheltered high school girl unleashes her newly developed telekinetic powers after she is pushed too far by her peers.",http://ia.media-imdb.com/images/M/MV5BMTc1MDIyOTkxN15BMl5BanBnXkFtZTgwMTU1NzEzMDE@._V1_SX300.jpg,tt1939659
134374,"Pain & Gain",130,2013-04-26,English,6.30,372,"Based on the true story of Daniel Lugo (Mark Wahlberg) a Miami bodybuilder who wants to live the American dream. He would like to have the money that other people have. So he enlists the help of fellow bodybuilder Adrian Doorbal (Anthony Mackie) and ex-convict, Christian bodybuilder Paul Doyle (Dwayne Johnson). Their kidnapping and extortion scheme goes terribly wrong since they have muscles for brains and they're left to haphazardly try to hold onto the elusive American dream.",http://ia.media-imdb.com/images/M/MV5BMTU0NDE5NTU0OV5BMl5BanBnXkFtZTcwMzI1OTMzOQ@@._V1_SX300.jpg,tt1980209
135397,"Jurassic World",0,2015-06-12,English,5.10,19,"There is currently no overview information available.",http://ia.media-imdb.com/images/M/MV5BMjEzNzg2NTMwOF5BMl5BanBnXkFtZTgwNjYzMTMyMDE@._V1_SX300.jpg,tt0369610
136400,"2 Guns",109,2013-10-01,English,6.90,282,"A DEA agent and an undercover Naval Intelligence officer who have been tasked with investigating one another find they have been set up by the mob -- the very organization the two men believe they have been stealing money from.",http://ia.media-imdb.com/images/M/MV5BNTQ5MTgzNDg4OF5BMl5BanBnXkFtZTcwMjAyODEzOQ@@._V1_SX300.jpg,tt1272878
136418,Hummingbird,100,2013-06-28,English,5.70,170,"Homeless and on the run from a military court martial, a damaged ex-special forces soldier navigating London's criminal underworld seizes an opportunity to assume another man's identity, transforming into an avenging angel in the process.",http://ia.media-imdb.com/images/M/MV5BMjI0ODc3NjI4NV5BMl5BanBnXkFtZTcwOTc3MzI1OQ@@._V1_SX300.jpg,tt1893256
136795,"The Heat",117,2013-06-28,English,6.80,366,"Uptight and straight-laced, FBI Special Agent Sarah Ashburn is a methodical investigator with a reputation for excellence--and hyper-arrogance. Shannon Mullins, one of Boston P.D.'s ""finest,"" is foul-mouthed and has a very short fuse, and uses her gut instinct and street smarts to catch the most elusive criminals. Neither has ever had a partner, or a friend for that matter. When these two wildly incompatible law officers join forces to bring down a ruthless drug lord, they become the last thing anyone expected: Buddies.",http://ia.media-imdb.com/images/M/MV5BMjA2MDQ2ODM3MV5BMl5BanBnXkFtZTcwNDUzMTQ3OQ@@._V1_SX300.jpg,tt2404463
137093,"Last Vegas",105,2013-11-01,English,7.20,108,"Three sixty-something friends take a break from their day-to-day lives to throw a bachelor party in Las Vegas for their last remaining single pal.",http://ia.media-imdb.com/images/M/MV5BMTQ2ODg2MTIyNF5BMl5BanBnXkFtZTgwMzU2NjgwMDE@._V1_SX300.jpg,tt1204975
137106,"The LEGO Movie",100,2014-02-06,English,8.00,113,"An ordinary Lego mini-figure, mistakenly thought to be the extraordinary MasterBuilder, is recruited to join a quest to stop an evil Lego tyrant from gluing the universe together.",http://ia.media-imdb.com/images/M/MV5BMTg4MDk1ODExN15BMl5BanBnXkFtZTgwNzIyNjg3MDE@._V1_SX300.jpg,tt1490017
137321,"Winter's Tale",118,2014-02-13,English,7.40,13,"A fantasy story set in 19th Century and present-day Manhattan and revolves around a thief, a dying girl, and a flying white horse.",http://ia.media-imdb.com/images/M/MV5BNTMyNjI1NTM4N15BMl5BanBnXkFtZTgwNjcwMzc1MDE@._V1_SX300.jpg,tt1837709
137824,Smuggler,325,1981-04-05,English,0.00,0,"Set during the Napoleonic wars of the early 1800s, Oliver Tobias (Arthur of the Britons) stars as Jack Vincent, a swashbuckling ex-British naval captain turned smuggler. A strong-willed, independent man who lives by both his wits and the sword, Vincent is ably assisted by Sarah (Lesley Dunlop - Where the Heart Is) and petty thief Honesty Evans (Hywel Williams Ellis) in his struggle to stay one step ahead of the Excise Men...",http://ia.media-imdb.com/images/M/MV5BMTQ0NTI5NDMwMl5BMl5BanBnXkFtZTcwNzU2NzY3MQ@@._V1_SX300.jpg,tt0081932
